username;date;retweets;favorites;text;geo;mentions;hashtags;id;permalink
fanquake;2017-03-29 00:35;0;0;"What's the deepest root growth you think you've seen where you've deep ripped? How far past 500mm?";;;;"846989138985472001";https://twitter.com/fanquake/status/846989138985472001
fanquake;2017-03-28 23:09;0;0;"yield difference with/without the plates?";;;;"846967597694373888";https://twitter.com/fanquake/status/846967597694373888
fanquake;2017-03-28 22:18;0;0;"what depth did you rip to?";;;;"846954672678154240";https://twitter.com/fanquake/status/846954672678154240
fanquake;2017-03-28 16:11;0;0;"What are your dl/upload limits?";;;;"846862352423170049";https://twitter.com/fanquake/status/846862352423170049
fanquake;2017-03-22 20:13;0;0;"Yea, I'd like to hear from someone who's run it. All the Agrtron setups I've seen have been ISOBUS so far";;;;"844748999143796736";https://twitter.com/fanquake/status/844748999143796736
fanquake;2017-03-22 20:05;2;4;"A few notes I've compiled on the Agtron vs Farmscan Ag kits. Let me know if I've got something wrong. pic.twitter.com/8B4cQ6457P";;;;"844746813605232640";https://twitter.com/fanquake/status/844746813605232640
fanquake;2017-03-22 19:12;3;1;"Any recommendations/experiences with blockage monitors. Putting on a JD1820bar, JD1910 box. Looked at Agtron and Farmscan. Wireless or not?";;;;"844733478239293440";https://twitter.com/fanquake/status/844733478239293440
fanquake;2017-03-19 19:28;0;1;"Hi Jamie, If your in the pdk, open https:// hectare.ag/demo and upload your KML. Should see map & location marker. pic.twitter.com/bhXaF2n0Z0";;;;"843650492236353536";https://twitter.com/fanquake/status/843650492236353536
fanquake;2017-03-18 16:20;2;12;"Lime spreading. pic.twitter.com/sPmB45RHoL";;;;"843240603873771524";https://twitter.com/fanquake/status/843240603873771524
fanquake;2017-03-14 06:12;0;2;"~half metre of 90degree curtain has worked well for us. 3rd yr, no trouble. pic.twitter.com/eMXZfoejD1";;;;"841638208123297794";https://twitter.com/fanquake/status/841638208123297794
fanquake;2017-03-09 02:42;0;0;"Interested to watch when the video is available";;;;"839788489784741888";https://twitter.com/fanquake/status/839788489784741888
fanquake;2017-03-04 17:27;23;12;"Looking for 2 operators for seeding. Farm 100km NE of Geraldton. (5hrs North of Perth). Start ASAP. Currently deep ripping, spreading etc pic.twitter.com/RaVeplalE7";;;;"838199332083904513";https://twitter.com/fanquake/status/838199332083904513
fanquake;2017-02-21 04:31;1;2;"yea a combination of different data. Subsoil mapping, soil tests, yield maps etc. pic.twitter.com/Y5nufDvG0J";;;;"834017618084323330";https://twitter.com/fanquake/status/834017618084323330
fanquake;2017-02-21 04:09;0;1;"however, that was a few years ago, so using zones now. Like this: pic.twitter.com/cBhVsWTpaT";;;;"834012203254624256";https://twitter.com/fanquake/status/834012203254624256
fanquake;2017-02-21 04:08;0;0;"no zones used there (flat rate 1700kg). The spotting basically show the variance in what the machines says it's putting out.";;;;"834011997561712641";https://twitter.com/fanquake/status/834011997561712641
fanquake;2017-02-21 04:00;0;0;"what rate was being put out. Target was ~1700kg/ha . Red is <1700kg/ha, green 1700 - 1750kg/ha, yellow > 1750kg/ha";;;;"834009992533381120";https://twitter.com/fanquake/status/834009992533381120
fanquake;2017-02-21 03:59;0;0;"bit hard to see with the low resolution, but those are skipped runs, nothing run over twice.";;;;"834009543147294720";https://twitter.com/fanquake/status/834009543147294720
fanquake;2017-02-16 03:35;0;0;"whole farm average? It can vary from paddock to paddock.";;;;"832191563757293572";https://twitter.com/fanquake/status/832191563757293572
fanquake;2017-02-10 09:33;0;0;"what is the average farm size?";;;;"830107553623334913";https://twitter.com/fanquake/status/830107553623334913
fanquake;2017-02-09 00:37;0;1;"I'll settle for a few photos posted to Twitter heh";;;;"829610097584267264";https://twitter.com/fanquake/status/829610097584267264
fanquake;2017-02-09 00:11;0;1;"@camparker62 are you seeing any difference between stubble types? How about on different coloured soils?";;@camparker62;;"829603664142667777";https://twitter.com/fanquake/status/829603664142667777
fanquake;2017-02-08 04:22;0;1;"yep, or use the browser on your phone. Pretty inconvenient either way.";;;;"829304288983789570";https://twitter.com/fanquake/status/829304288983789570
fanquake;2017-02-08 00:24;0;1;"it's crazy that you can't turn email notifications off in the twitter app.";;;;"829244542280929280";https://twitter.com/fanquake/status/829244542280929280
fanquake;2017-02-06 04:33;2;5;"Has anyone in WA had a chance to look at/trial one of these yet? https:// twitter.com/seed_terminato r/status/828568896563081216 …";;;;"828582362476744704";https://twitter.com/fanquake/status/828582362476744704
fanquake;2017-02-06 03:24;0;0;"I'd be interested to know more about the tables your operating on.";;;;"828565076353310720";https://twitter.com/fanquake/status/828565076353310720
fanquake;2017-02-06 01:39;0;0;"ok, only questioned because the hardest part can just be actually uploading the data if many GB.";;;;"828538554603098112";https://twitter.com/fanquake/status/828538554603098112
fanquake;2017-02-06 01:37;0;0;"you could dump all your data in a S3 bucket and trust it's backed up for a few cents a month.";;;;"828538191577698304";https://twitter.com/fanquake/status/828538191577698304
fanquake;2017-02-06 01:36;0;1;"fast maybe, some complexity in setting it up and accessing data. However S3 is very cheap for storage.";;;;"828537884693008384";https://twitter.com/fanquake/status/828537884693008384
fanquake;2017-02-05 23:15;0;0;"how much data? I can give you a demo of @hectareAg .";;@hectareAg;;"828502313086095360";https://twitter.com/fanquake/status/828502313086095360
fanquake;2017-02-05 04:34;0;0;"3-5 zones from soil tests/EM38/Yield. What data are you using to create that map? Yield+something else?";;;;"828220297631264769";https://twitter.com/fanquake/status/828220297631264769
fanquake;2017-02-04 12:36;0;0;"no time for the West Coast?";;;;"827979285629640704";https://twitter.com/fanquake/status/827979285629640704
fanquake;2017-02-03 00:02;1;0;"Will you be attending the GRDC updates this year?";;;;"827426953393106944";https://twitter.com/fanquake/status/827426953393106944
fanquake;2017-01-31 02:05;0;1;"wouldn't demand remain constant causing the price fall? Which could actually have the affect of increasing demand?";;;;"826370720523509760";https://twitter.com/fanquake/status/826370720523509760
fanquake;2017-01-19 16:22;0;0;"maybe something to pickup and mulch winrows on the go, and put in behind tines. Not really sure yet.";;;;"822237855149756416";https://twitter.com/fanquake/status/822237855149756416
fanquake;2017-01-19 16:19;0;1;"yes we are trying to figure out the best way to feed substance in behind deep ripper tines.";;;;"822237104818176000";https://twitter.com/fanquake/status/822237104818176000
fanquake;2017-01-18 18:31;0;0;"There was some trial work done with inclusion plates up here @BindiIsbister .";;@BindiIsbister;;"821908027917799424";https://twitter.com/fanquake/status/821908027917799424
fanquake;2017-01-18 03:24;0;2;"I think the reverse engineering would be easier than finding the profits from the protein data alone.";;;;"821679698099007490";https://twitter.com/fanquake/status/821679698099007490
fanquake;2017-01-16 20:13;0;0;"no response to wide-row lupins? We have had success with them up here, as well as canola.";;;;"821208794738720768";https://twitter.com/fanquake/status/821208794738720768
fanquake;2017-01-15 20:42;3;1;"Anyone have recommendations for farm security cameras? Need a few to put around sheds. #agchatoz";;;#agchatoz;"820853684292571136";https://twitter.com/fanquake/status/820853684292571136
fanquake;2017-01-09 21:43;0;2;"pic.twitter.com/ESTIP3WCDH";;;;"818694770696458240";https://twitter.com/fanquake/status/818694770696458240
fanquake;2017-01-07 15:41;0;0;"yes, the sensors are inside the white boxes.";;;;"817878895613480961";https://twitter.com/fanquake/status/817878895613480961
fanquake;2017-01-07 15:15;0;0;"it detects weeds on the go, and only spot sprays them, rather than a blanket spray. http://www. weedit.com.au";;;;"817872376238993408";https://twitter.com/fanquake/status/817872376238993408
fanquake;2017-01-06 04:08;0;1;"if in csv format, lots of ways to go. You could try drawing and downloading (.shp) zones here https:// hectare.ag/draw";;;;"817342075779760128";https://twitter.com/fanquake/status/817342075779760128
fanquake;2017-01-06 04:02;0;0;"how deep are you planning on going? Trying inclusion plates? Why soil type/s";;;;"817340435991379969";https://twitter.com/fanquake/status/817340435991379969
fanquake;2017-01-05 22:15;0;2;"pass times are somewhat random, ~20 days. Decreasing though. pic.twitter.com/OlWGltqZZY";;;;"817253140739158016";https://twitter.com/fanquake/status/817253140739158016
fanquake;2017-01-05 21:58;0;1;"we have the luxury of the farm constantly being cut in half. pic.twitter.com/3tJbXpRImN";;;;"817248899756761089";https://twitter.com/fanquake/status/817248899756761089
fanquake;2017-01-04 23:38;0;1;"we have been using VR for a while. Zones similar to attached. pic.twitter.com/pxUInm1yXs";;;;"816911670752595969";https://twitter.com/fanquake/status/816911670752595969
fanquake;2017-01-04 19:41;0;0;"I'd also like to know how many we need before we can calibrate sat imagery and trust it across the farm. 1/zone is impractical";;;;"816852164433702912";https://twitter.com/fanquake/status/816852164433702912
fanquake;2017-01-04 19:37;0;0;"yea, would like to have a couple more moisture probes on the farm.";;;;"816850979412791296";https://twitter.com/fanquake/status/816850979412791296
fanquake;2017-01-04 16:56;0;0;"How would you do that, if cost wasn't a problem?";;;;"816810574591893504";https://twitter.com/fanquake/status/816810574591893504
fanquake;2017-01-03 20:12;1;1;"This is a pretty good summary of how it can work http://www. quadratic.be/en/le-suivi-de -letat-hydrique-ndwi-des-cultures-par-les-series-temporelles-sentinel-2/ … , same Satellite as picture here (Sentinel 2).";;;;"816497502832558080";https://twitter.com/fanquake/status/816497502832558080
fanquake;2017-01-03 20:11;0;3;"by looking at the diff between certain light bands. You don't get mm/10m2 or anything. Hence the want to "try" and truth data.";;;;"816497367503368192";https://twitter.com/fanquake/status/816497367503368192
fanquake;2017-01-03 19:51;0;0;"This is an much research/ideas as anything else. Interested to hear thoughts.";;;;"816492157716471808";https://twitter.com/fanquake/status/816492157716471808
fanquake;2017-01-03 19:50;0;2;"Could we even tell/know about that moisture in season? Why hasn't it been used? Should we adjust zones for next year?";;;;"816492003823235072";https://twitter.com/fanquake/status/816492003823235072
fanquake;2017-01-03 19:49;0;1;"If there are large areas of unused soil moisture left post harvest, should we have done more to try and used it in season?";;;;"816491604747767808";https://twitter.com/fanquake/status/816491604747767808
fanquake;2017-01-03 19:47;0;1;"The top lefthand third of the paddock was wind-rowed, everything else done with MAV. No stubble to reflect heat = less moisture.";;;;"816491203118043136";https://twitter.com/fanquake/status/816491203118043136
fanquake;2017-01-03 19:40;0;0;"Do you have a uniform data example? Otherwise, these kind of maps, if they time data somewhere, would be great.";;;;"816489345716658177";https://twitter.com/fanquake/status/816489345716658177
fanquake;2017-01-03 19:38;2;6;"Lupins. 276mm GSR. Colour and moisture map 10 days pre harvest. Yield map. Moisture 10 days post harvest. How much moisture left un-unused? pic.twitter.com/yxpLfYgX3S";;;;"816489041663127552";https://twitter.com/fanquake/status/816489041663127552
fanquake;2017-01-03 19:16;0;0;"to answer original question. If moisture data has time attached, use that + sat timing to try and figure out moisture change/t";;;;"816483300923408384";https://twitter.com/fanquake/status/816483300923408384
fanquake;2017-01-03 19:14;0;1;"Some maps are even worse. pic.twitter.com/Hgs5N6lxzy";;;;"816482807656554497";https://twitter.com/fanquake/status/816482807656554497
fanquake;2017-01-03 19:13;0;0;"that's one of the challenges, and something that I think renders our a lot of our moisture data somewhat useless. See attached. pic.twitter.com/h6lrmH2IBr";;;;"816482595378634752";https://twitter.com/fanquake/status/816482595378634752
fanquake;2017-01-03 19:01;2;0;"Still looking for some harvest moisture maps to help ground truth satellite data. Email/Message for info #agchatoz";;;#agchatoz;"816479757386645504";https://twitter.com/fanquake/status/816479757386645504
fanquake;2017-01-01 18:50;0;0;"What do you use to create those maps?";;;;"815752079427780608";https://twitter.com/fanquake/status/815752079427780608
fanquake;2017-01-01 04:07;0;1;"I think @AmeryDrage has done something like that.";;@AmeryDrage;;"815529808280944640";https://twitter.com/fanquake/status/815529808280944640