username;date;retweets;favorites;text;geo;mentions;hashtags;id;permalink
gmaxnull;2017-10-19 20:27;3;5;"Jihan admits on WeChat to plan to segwit2x https://www. reddit.com/r/btc/comments /77jiyv/jihan_admits_on_wechat_to_plan_to_segwit2x/?st=J8ZC3VPL&sh=3f9bcd6b …";;;;"921216266429501445";https://twitter.com/gmaxnull/status/921216266429501445
gmaxnull;2017-10-08 12:13;0;0;"Or how about you actually release your wallet before you expect someone to work on it?";;;;"917105796156219393";https://twitter.com/gmaxnull/status/917105796156219393
gmaxnull;2017-10-08 12:13;0;0;"Tell @adam3us to shut the fuck up if he wants peace. It’s just his gums flapping right now.";;@adam3us;;"917105609102721024";https://twitter.com/gmaxnull/status/917105609102721024
gmaxnull;2017-10-08 12:11;0;3;"Core devs never said no to bigger blocks, we just want it done on our terms, I mean the users’.";;;;"917105288846725120";https://twitter.com/gmaxnull/status/917105288846725120
gmaxnull;2017-09-30 19:16;0;3;"Is that the new name you clown? bizcoin?";;;;"914313050890604544";https://twitter.com/gmaxnull/status/914313050890604544
gmaxnull;2017-09-29 10:27;0;0;"The core devs are not willing to let their chain be killed so I believe they will hard fork themselves.";;;;"913817461950177282";https://twitter.com/gmaxnull/status/913817461950177282
gmaxnull;2017-09-29 10:25;0;0;"Yes @lukejr has most of the Bitcoins";;@lukejr;;"913816895580721154";https://twitter.com/gmaxnull/status/913816895580721154
gmaxnull;2017-09-29 10:23;0;1;"The folks who are anti-segwit2x seem to think they’ll make the segwit2x group blink by threatening them. They stopped listening long ago.";;;;"913816498854137857";https://twitter.com/gmaxnull/status/913816498854137857
gmaxnull;2017-09-29 10:20;0;2;"Better just prepare the PoW hard fork @adam3us @morcosa";;@adam3us @morcosa;;"913815855271727104";https://twitter.com/gmaxnull/status/913815855271727104
gmaxnull;2017-09-29 10:20;0;1;"Also their users are not that educated at a deep level on Bitcoin and unlikely to rebel and stop using their services.";;;;"913815746555281408";https://twitter.com/gmaxnull/status/913815746555281408
gmaxnull;2017-09-29 10:19;0;1;"It’s clear segwit2x success is unaffected by no2x protesting. They have no power to affect the people makin up their minds.";;;;"913815627210592256";https://twitter.com/gmaxnull/status/913815627210592256
gmaxnull;2017-09-27 17:59;0;0;"Of an old man who doesn't understand technology? Your impression is pretty good actually.";;;;"913206606992637954";https://twitter.com/gmaxnull/status/913206606992637954
gmaxnull;2017-09-27 16:20;0;1;"@SatoshiLite doesn’t care about Bitcoin he just wants Litecoin to reap the benefits of a dysfunctional Bitcoin. #nohero";;@SatoshiLite;#nohero;"913181685591789568";https://twitter.com/gmaxnull/status/913181685591789568
gmaxnull;2017-09-27 16:19;0;1;"It’s just sad begging on /r/bitcoin for segwit2x to end. What fools! Just PoW change it already. @adam3us is just a sad wuss.";;@adam3us;;"913181449335042048";https://twitter.com/gmaxnull/status/913181449335042048
gmaxnull;2017-09-16 18:47;0;1;"All you have to do is read this feed and you’ll be dumber instantly. Check out @pierre_rochard .";;@pierre_rochard;;"909232362898313217";https://twitter.com/gmaxnull/status/909232362898313217
gmaxnull;2017-09-05 14:12;0;1;"@SatoshiLite when will you just admit that @litecoin is a complete carbon copy wannabe Bitcoin? what a joke.";;@SatoshiLite @litecoin;;"905176890897522690";https://twitter.com/gmaxnull/status/905176890897522690
gmaxnull;2017-07-07 16:48;0;0;"Oh I'm so mad that everyone is mad at me. I'm trying to microscale here cc: @petertoddbtc";;@petertoddbtc;;"883472942683881474";https://twitter.com/gmaxnull/status/883472942683881474
gmaxnull;2017-06-30 13:38;0;2;"Our consensus is rough like the skin of your balls";;;;"880888208715919360";https://twitter.com/gmaxnull/status/880888208715919360
gmaxnull;2017-06-20 16:59;0;0;"I feel like we could kill time on this forever! Forget work.";;;;"877315020278968323";https://twitter.com/gmaxnull/status/877315020278968323
gmaxnull;2017-06-20 16:53;0;0;"Charlie we really milked LTC for quite a pump! Glad to see you tell it like it is!";;;;"877313588284837888";https://twitter.com/gmaxnull/status/877313588284837888
gmaxnull;2017-06-20 16:50;1;1;"@adam3us are the DoS cannons ready??";;@adam3us;;"877312700107370496";https://twitter.com/gmaxnull/status/877312700107370496
gmaxnull;2017-06-20 16:49;1;1;"We are preparing our miners for a pointed attack against these frankensegwit retards. Two oversized txs is all it will take to smoke em.";;;;"877312594788462596";https://twitter.com/gmaxnull/status/877312594788462596
gmaxnull;2017-06-20 16:46;0;0;"What a clown. Can't even keep his own shit straight!";;;;"877311755063635968";https://twitter.com/gmaxnull/status/877311755063635968
gmaxnull;2017-06-14 18:45;0;1;"Finally they're taking my commands seriously";;;;"875167459149578240";https://twitter.com/gmaxnull/status/875167459149578240
gmaxnull;2017-06-03 09:49;0;0;"Of course this account is fake. Do some due diligence Taylor.";;;;"871046146533322753";https://twitter.com/gmaxnull/status/871046146533322753
gmaxnull;2017-06-03 09:48;0;1;"That's BS I am next in line";;;;"871045825060904960";https://twitter.com/gmaxnull/status/871045825060904960
gmaxnull;2017-05-17 18:08;0;0;"I need that blue check...";;;;"865011104732168192";https://twitter.com/gmaxnull/status/865011104732168192
gmaxnull;2017-05-17 18:00;0;0;"I'll defer to @adam3us";;@adam3us;;"865009182231085056";https://twitter.com/gmaxnull/status/865009182231085056
gmaxnull;2017-05-17 17:55;0;2;"This whole proposal is bullshit";;;;"865007832843771904";https://twitter.com/gmaxnull/status/865007832843771904
gmaxnull;2017-04-06 06:36;0;3;"The only problem with this premise is that I don't make mistakes";;;;"849979095173783552";https://twitter.com/gmaxnull/status/849979095173783552
gmaxnull;2017-03-23 17:23;0;1;"so Luke-jr my friend of Jesus is your enemy!!!!????";;;;"845068437097467904";https://twitter.com/gmaxnull/status/845068437097467904
gmaxnull;2017-01-20 18:28;0;1;"it will be no more consequential than the day @SatoshiLite brought us his altcoin";;@SatoshiLite;;"822631840968310785";https://twitter.com/gmaxnull/status/822631840968310785
gmaxnull;2017-01-20 18:26;0;2;"@bendavenport pic.twitter.com/8y5lXSgtVK";;@bendavenport;;"822631378437230593";https://twitter.com/gmaxnull/status/822631378437230593
gmaxnull;2017-01-20 18:25;1;1;"they will be stuck with the original creators obsolete ideas";;;;"822631052749504519";https://twitter.com/gmaxnull/status/822631052749504519
gmaxnull;2017-01-20 18:22;0;2;"sigh this shit is tiring. I'm gonna pet my cat.";;;;"822630498887409671";https://twitter.com/gmaxnull/status/822630498887409671