username;date;retweets;favorites;text;geo;mentions;hashtags;id;permalink
peterktodd;2018-02-06 13:16;17;287;"COOLEST ROCKET LAUNCH EVER! (and I mean, any rocket launch is cool so @spacex did well today)";;@spacex;;"960985491389763585";https://twitter.com/peterktodd/status/960985491389763585
peterktodd;2018-02-06 06:15;20;89;"Direct link: https:// blog.bitmex.com/the-ripple-sto ry/ …";;;;"960879613059698688";https://twitter.com/peterktodd/status/960879613059698688
peterktodd;2018-02-06 06:15;563;1171;""Apparently, Ripple is missing 32,570 blocks from the start of the ledger and nodes are not able to obtain this data. This means that one may be unable to audit the whole chain and the full path of Ripple’s original 100 billion XRP launch." @BitMEXResearch Very interesting!";;@BitMEXResearch;;"960879611231039495";https://twitter.com/peterktodd/status/960879611231039495
peterktodd;2018-02-06 06:15;12;55;""One could argue that therefore this validation has limited value and that Ripple has significant control over the ledger." @BitMEXResearch";;@BitMEXResearch;;"960879609490411520";https://twitter.com/peterktodd/status/960879609490411520
peterktodd;2018-02-06 06:15;56;182;"Was asked to delete my previous tweet on @BitMEXResearch 's Ripple report. Actual report is diplomatic: "In addition to the potentially misleading marketing, the [quorum consensus] and 80% threshold is not necessary and merely adds to the obfuscation, in our view." pic.twitter.com/wYp6mmkrUp";;@BitMEXResearch;;"960879603899355137";https://twitter.com/peterktodd/status/960879603899355137
peterktodd;2018-02-05 20:54;1;79;""if I could be as annoying as anyone, I'd be as annoying as Peter Todd" #BitcoinSignGuy @GucciDatAss @otsproofbot";;@GucciDatAss @otsproofbot;#BitcoinSignGuy;"960738511027519488";https://twitter.com/peterktodd/status/960738511027519488
peterktodd;2018-02-04 23:38;176;547;"If your definition of "true currency" requires that it be easy to seize, and have no privacy security, I'm going to stick with "fake currency". Like the paper bills in my wallet. https:// twitter.com/steve_hanke/st atus/960186688558587904 …";;;;"960417252012040192";https://twitter.com/peterktodd/status/960417252012040192
peterktodd;2018-02-02 01:39;0;4;"Not that credible, which is ironic, because as @eiaine pointed out routing attacks are a real problem, just not in the way the paper envisioned; the paper's assumptions are oversimplified.";;@eiaine;;"959360692947124224";https://twitter.com/peterktodd/status/959360692947124224
peterktodd;2018-02-01 23:36;7;38;"https:// twitter.com/Joi/status/959 077649258655744 …";;;;"959329589146374144";https://twitter.com/peterktodd/status/959329589146374144
peterktodd;2018-02-01 23:35;39;112;"Good article, but dubious how @wired changed the title from @Joi 's "The Big ICO Swindle" to implicate Bitcoin as well. https://www. wired.com/story/ico-cryp tocurrency-irresponsibility …";;@wired @Joi;;"959329462612582400";https://twitter.com/peterktodd/status/959329462612582400
peterktodd;2018-02-01 06:55;0;11;""...like a mohawk, but basically a mountain range." "Made out of rock?" "Yes, exactly."";;;;"959077853173235713";https://twitter.com/peterktodd/status/959077853173235713
peterktodd;2018-01-31 23:53;46;195;"Sadly matches my experiences with cops: nearly 100% are unethical and will happily overlook their fellow officers doing illegal and unethical things. We're probably at the point that many places need to fire their entire police forces and replace them; dishonesty is contagious. https:// twitter.com/CitizenMurphy/ status/958435535294484481 …";;;;"958971511443992576";https://twitter.com/peterktodd/status/958971511443992576
peterktodd;2018-01-31 23:10;0;0;"Wait, what repo do you think I was contributing to in 2012?";;;;"958960615917326336";https://twitter.com/peterktodd/status/958960615917326336
peterktodd;2018-01-31 22:45;1;2;"9c80b770fda86a72838c73bfec657bdd28e7bb4f35f43b900871782aa012e729 @otsproofbot";;@otsproofbot;;"958954532192612353";https://twitter.com/peterktodd/status/958954532192612353
peterktodd;2018-01-31 02:08;0;1;"I just had to read the "LatinAmer" in the URL and know what you were linking too. :)";;;;"958643167301021696";https://twitter.com/peterktodd/status/958643167301021696
peterktodd;2018-01-30 22:59;0;0;"Actually I'm from Canada, which is in the top ten on all three of those charts.";;;;"958595601393967106";https://twitter.com/peterktodd/status/958595601393967106
peterktodd;2018-01-30 20:06;9;61;"So @quantum1net felt the need to send a researcher a Cease & Desist? Sounds like a scam to me... https:// twitter.com/Jogenfors/stat us/958357736877674496 …";;@quantum1net;;"958552140095639552";https://twitter.com/peterktodd/status/958552140095639552
peterktodd;2018-01-30 19:44;0;0;"I had a 3d modeling class where I decided learning 3d modeling for art wasn't going to be useful, so my teacher let me learn some CAD software instead, and in addition to that I submitted a physical artwork that implemented 3d rendering of a cube on a cheap microcontroller.";;;;"958546541056282625";https://twitter.com/peterktodd/status/958546541056282625
peterktodd;2018-01-30 19:42;0;0;"When I was in art school IIRC the requirements were a points system, with a few categories that you'd have to meet a given number of points in. So you had tremendous control over your curriculum, and on top of that teachers were incredibly flexible.";;;;"958546063094374401";https://twitter.com/peterktodd/status/958546063094374401
peterktodd;2018-01-30 19:41;0;0;"OTOH, had I been in engineering at the same school, I'd have a fixed course schedule, with IIRC the only variation allowed in first year being one or two electives. Also, you couldn't take engineering part time, as I was doing with physics.";;;;"958545657329078272";https://twitter.com/peterktodd/status/958545657329078272
peterktodd;2018-01-30 19:39;0;0;"Varies a lot, even within the same university. For instance, as I was in Physics, IIRC I could take any one of three parallel tracks of calculus classes, and outside of that had a fair amount of free choice.";;;;"958545319414980610";https://twitter.com/peterktodd/status/958545319414980610
peterktodd;2018-01-30 19:35;0;0;"So in fact, some people switched *to* my class as the semester progressed because they dropped the even harder version of it; the people who were dropping it were probably switching to the next easier variant.";;;;"958544349385641985";https://twitter.com/peterktodd/status/958544349385641985
peterktodd;2018-01-30 19:34;0;0;"The crazy thing is I wasn't even taking the hardest class! I was taking the second hardest version of that course - they had about five different variations of the first-year calculus courses.";;;;"958544028831764480";https://twitter.com/peterktodd/status/958544028831764480
peterktodd;2018-01-30 19:31;0;0;"IIRC the first day there weren't actually quite enough seats for everyone in the class, as they had overbooked knowing that there'd be enough seats in another two or three weeks.";;;;"958543273873862656";https://twitter.com/peterktodd/status/958543273873862656
peterktodd;2018-01-30 19:30;0;1;"Yeah, the first year, first semester, calculus and analysis course I took had something like a 80% drop out rate in my class in the first month or two, and even in second semester IIRC around 10% dropped out.";;;;"958543038728540160";https://twitter.com/peterktodd/status/958543038728540160
peterktodd;2018-01-30 19:25;0;0;"Yup, sounds very much like my experience. From what I've heard the particular classes I was taking were an unusually hard way of doing it so my experience may not be representative of most Canadian unis (I know for a fact the engineering calculus courses at that uni were easier).";;;;"958541735361155073";https://twitter.com/peterktodd/status/958541735361155073
peterktodd;2018-01-30 19:22;0;0;"For example, rather than, say, just teaching you that d/dx sin(x) = cos(x), the goal of the class was to have you be able to prove *why* that's true with limit proofs. Those kinds of proofs are easy to memorize, but really, really, difficult to derive yourself without peeking.";;;;"958540884223635458";https://twitter.com/peterktodd/status/958540884223635458
peterktodd;2018-01-30 19:18;0;0;"Ah, yeah, that explains why: this would have been far more theoretical than the material you were teaching. Basically the "calculus" class taught calculus by first teaching you how to prove that calculus works with limits and what not; you were meant to derive the rules yourself.";;;;"958539984486748160";https://twitter.com/peterktodd/status/958539984486748160
peterktodd;2018-01-30 19:13;0;0;"As I said elsewhere, I was in a position in my career that marks didn't matter _that_ much to me - I was already working full time in engineering, and taking physics part time. So I mostly looked at that broken system with amusement. :)";;;;"958538599695298560";https://twitter.com/peterktodd/status/958538599695298560
peterktodd;2018-01-30 19:11;0;0;"Yeah, I don't blame those students for taking that approach; many teachers cautioned against it, but they weren't going to outright try to ban it. Equally, like I said the very best students - I was *not* one of them - were good enough they'd both grok the material and ace tests.";;;;"958538158848790529";https://twitter.com/peterktodd/status/958538158848790529
peterktodd;2018-01-30 19:09;0;0;"The was a satirical article, taken a bit too seriously by the OP. I was showing a nuanced semi-counter-example where the current state of the art in teaching and testing doesn't give good results, and does need improvement. Equally, made clear that I agreed it's the best we have.";;;;"958537626662916096";https://twitter.com/peterktodd/status/958537626662916096
peterktodd;2018-01-30 19:06;0;2;"You still need some skill of course, as some things lend themselves to combinatorial combinations of problems. But once you figure out how to separate them you can brute force the underlying classes of problem (which of course is what lower level rout equation manipulation is!).";;;;"958536894563962880";https://twitter.com/peterktodd/status/958536894563962880
peterktodd;2018-01-30 19:04;0;1;"Basically, they'd get every test and exam that the teachers had ever made, and put every problem into categories - throwing out the trivial variations. So a study guide was simply every problem category you might run into an the answer to it.";;;;"958536488932782080";https://twitter.com/peterktodd/status/958536488932782080
peterktodd;2018-01-30 19:02;0;0;"What level of math did you teach? Remember that this was fairly high level, so there just aren't that many unique problems out there at all; only so many different things you can ask a student to prove. For context, a study guide for the crammers would be ~100 pages/test.";;;;"958535833279180801";https://twitter.com/peterktodd/status/958535833279180801
peterktodd;2018-01-30 18:59;0;0;"...it's possible that's just coincidence.";;;;"958535205924556800";https://twitter.com/peterktodd/status/958535205924556800
peterktodd;2018-01-30 18:56;0;0;"That's why I used the term "mainly" - to make it clear that it wasn't a phenomenon exclusive to Asian students. Of course, my classes were majority Asian students, especially Chinese (IIRC something like 25% in the math classes were Chinese citizens on visas) so...";;;;"958534314727178241";https://twitter.com/peterktodd/status/958534314727178241
peterktodd;2018-01-30 18:43;0;0;"Huh? I'm not saying how you *should* determine hiring, but how you *shouldn't* blindly put all your emphasis on test scores; I'm not saying what you should do instead, and don't have a good answer. Anyway, both Asians and non-Asians fell into both categories, as I made clear.";;;;"958531259365543937";https://twitter.com/peterktodd/status/958531259365543937
peterktodd;2018-01-30 18:39;0;1;"My teachers were generally pretty good about that; some of them even specifically told you not to try to cram for the tests by memorizing solved problems, and told you exactly this as to why you shouldn't do that. I'm sure everything I'm saying here is fairly well known.";;;;"958530124588244997";https://twitter.com/peterktodd/status/958530124588244997
peterktodd;2018-01-30 18:34;0;0;"There's nothing unmeritocratic about trying to hire for what you actually need rather than a less-relevant metric that doesn't match your actual requirements. For example, I wouldn't place much emphasis on Chess tournament scores when hiring engineers.";;;;"958528927865196544";https://twitter.com/peterktodd/status/958528927865196544
peterktodd;2018-01-30 18:30;0;0;"Remember that the goal of these classes is not to teach you how to answer questions on tests that you've seen before, but rather, how to solve completely novel problems with math. The big problem is there isn't a limitless supply of completely novel problems.";;;;"958527992237522944";https://twitter.com/peterktodd/status/958527992237522944
peterktodd;2018-01-30 18:29;0;0;"You'd see this in test results for the (rare) times that the teachers could come up with a sufficiently new problem that the cramming students didn't have it in their study guides (which incidentally, were prepared by companies outside the university).";;;;"958527589391503362";https://twitter.com/peterktodd/status/958527589391503362
peterktodd;2018-01-30 18:26;0;0;"I and a few students who studied with me _did_ do better on the tests, but only for problems that neither group of student had seen the answers for. That's precisely why the cramming students thought we were so good: we could answer questions on _new_ material in class.";;;;"958526967762038784";https://twitter.com/peterktodd/status/958526967762038784
peterktodd;2018-01-30 18:22;0;1;"See, some people are just brilliant. The aim of the courses I was taking was to help you become that level of brilliance, and one way to do that appears to be by stuggling hard against piles of problems without answers.";;;;"958525989793030146";https://twitter.com/peterktodd/status/958525989793030146
peterktodd;2018-01-30 18:20;0;0;"When there's only something like 1000 problems that teachers over the years have come up with for that topic, you can easily screw up your entire ability to learn that creative process because you've spoiled for yourself all the possible study material.";;;;"958525368360734720";https://twitter.com/peterktodd/status/958525368360734720
peterktodd;2018-01-30 18:18;0;1;"Remember that this is relatively high level math I'm talking about, not highschool level mechanical solving of problems. Solving problems you had never seen before helped you learn to be creative; seeing the answers screwed up that process.";;;;"958524789722963968";https://twitter.com/peterktodd/status/958524789722963968
peterktodd;2018-01-30 18:14;0;1;"The definitely is really simple: if you get the math, you can solve any problem based on that math, not just specific problems. Those cram-dependent students who had asked me for help had the problem that they could answer specific problems they had seen, but not in general.";;;;"958523879076564993";https://twitter.com/peterktodd/status/958523879076564993
peterktodd;2018-01-30 17:59;0;1;"I personally wasn't in that position, as at the time I was already working almost full-time in my chosen career doing analog electronics design at a startup. I was doing a physics degree part time because I genuinely wanted to learn physics for my career. I just needed to pass.";;;;"958519959633715202";https://twitter.com/peterktodd/status/958519959633715202
peterktodd;2018-01-30 17:57;1;0;"Though to their credit, I think many of the students who learned by cramming answers understood what the problem was in why they weren't learning the actual math. But when advancement is geared to test results, there's strong incentives to cram.";;;;"958519603214372864";https://twitter.com/peterktodd/status/958519603214372864
peterktodd;2018-01-30 17:56;0;0;"Those students themselves told me that. That's what was so strange about it - I'd have those students come to *me* asking me for help in understanding the math, yet they were getting better marks than me.";;;;"958519339568844800";https://twitter.com/peterktodd/status/958519339568844800
peterktodd;2018-01-30 17:42;7;54;"My marks in linear algebra were far better than calculus/analytics, yet I learned practically nothing. tl;dr: School is a simulation of real learning. Although I'd 100% do it again and don't have a better alternative.";;;;"958515676158840832";https://twitter.com/peterktodd/status/958515676158840832
peterktodd;2018-01-30 17:41;2;7;"So yes, those cramming study groups ruined it for everyone, including themselves. ...and funny enough, I had the same experience myself with linear algebra: I had very little intuition for it, so just crammed homework until I had it memorized.";;;;"958515673805836288";https://twitter.com/peterktodd/status/958515673805836288
peterktodd;2018-01-30 17:41;2;12;"...they did very well on the tests. That said, there were some people who were so good in my study groups they not only groked the math, but could also ace the tests. But if you hired based on the tests, you'd also get a pile of hopeless students who'd never make anything new.";;;;"958515671402467328";https://twitter.com/peterktodd/status/958515671402467328
peterktodd;2018-01-30 17:41;1;8;"In fact, I was very close to failing, and other "top students" weren't doing well either. See, we were badly beaten in tests by the (mainly Asian) study groups who just relentlessly crammed the limited set of answers. Those students didn't actually understand the math, but...";;;;"958515668965642240";https://twitter.com/peterktodd/status/958515668965642240
peterktodd;2018-01-30 17:41;2;7;"This lead to a blizzare outcome for me: I was leading study groups, and getting a good understanding of the math. So my fellow students generally assumed I was one of the top students, along with some others in my study groups. But that wasn't true at all!";;;;"958515666822328320";https://twitter.com/peterktodd/status/958515666822328320
peterktodd;2018-01-30 17:41;1;7;"While I and a handful of other students focused on learning general strategies to solving problems and practicing them, most other students focused on learning the answers. But those are spoilers! The problem space isn't very big, so with effort you really could memorize 100%";;;;"958515664691613696";https://twitter.com/peterktodd/status/958515664691613696
peterktodd;2018-01-30 17:41;1;4;"There's a relatively limited set of things you might be asked to prove in the classes. But you're supposed to learn how to prove things with math *in general*, not just the specific examples they'd give you.";;;;"958515662372134912";https://twitter.com/peterktodd/status/958515662372134912
peterktodd;2018-01-30 17:41;1;6;"So homework and tests are about finding ways of proving statements, including the fundamental basis of calculus itself; this was much more advanced than just studying calculus itself. The problem is it's very difficult to come up with new problems for students to solve.";;;;"958515659754876929";https://twitter.com/peterktodd/status/958515659754876929
peterktodd;2018-01-30 17:41;5;37;"Funny article, but there definitely are cases where a group of students who cram ruin it for everyone else. I ran into this back in uni in my calculus/analytics classes. First of all you have to understand that these classes are meant to teach you how to prove things w/ math... https:// twitter.com/clairlemon/sta tus/958237148561391617 …";;;;"958515657078968321";https://twitter.com/peterktodd/status/958515657078968321
peterktodd;2018-01-30 17:04;0;1;"Nah, I'd have made the bet: still better than 50% odds that you weren't an advisor. :)";;;;"958506345245892609";https://twitter.com/peterktodd/status/958506345245892609
peterktodd;2018-01-30 16:52;0;3;"For you I'd ask for time-stamped proof first. :P";;;;"958503211224260608";https://twitter.com/peterktodd/status/958503211224260608
peterktodd;2018-01-30 16:08;1;8;"I'd bet $5k that @james_hilliard and @jfnewbery aren't actual advisors either...";;@james_hilliard @jfnewbery;;"958492070343196674";https://twitter.com/peterktodd/status/958492070343196674
peterktodd;2018-01-30 03:37;1;9;"For some reason I read that as "Rich Faithfulness"";;;;"958303141979676672";https://twitter.com/peterktodd/status/958303141979676672
peterktodd;2018-01-29 14:59;89;388;"Top item on /r/BTC right now "/r/Bitcoin is censoring the NIST report" Where did I learn about that NIST report? From /r/bitcoin this morning, who thoroughly debunked it. Dishonest butthurt scammers be dishonest butthurt scammers. pic.twitter.com/PwC9IYiWSN";;;;"958112393367711745";https://twitter.com/peterktodd/status/958112393367711745
peterktodd;2018-01-29 14:07;0;1;"Eh, the playground bullies would say "Poof Marshal"";;;;"958099335538917376";https://twitter.com/peterktodd/status/958099335538917376
peterktodd;2018-01-29 14:05;0;1;"I call mine Squibbles! Er, I mean Emily.";;;;"958098796675612672";https://twitter.com/peterktodd/status/958098796675612672
peterktodd;2018-01-29 14:01;0;3;"Don't worry, that little chestburster will be out soon!";;;;"958097827028090880";https://twitter.com/peterktodd/status/958097827028090880
peterktodd;2018-01-29 12:09;3;13;"...and spritz! Don't forget the spritz.";;;;"958069709508812800";https://twitter.com/peterktodd/status/958069709508812800
peterktodd;2018-01-29 08:30;55;209;"One of the more important talks I've ever given. https:// twitter.com/kanzure/status /957660108137418752 …";;;;"958014376774127616";https://twitter.com/peterktodd/status/958014376774127616
peterktodd;2018-01-29 07:11;18;59;"Thread https:// twitter.com/nic__carter/st atus/957785010832052224 …";;;;"957994561678159872";https://twitter.com/peterktodd/status/957994561678159872
peterktodd;2018-01-27 04:22;0;6;"If you're a clairvoyant future successes can also hold you back from future successes.";;;;"957227410864291842";https://twitter.com/peterktodd/status/957227410864291842
peterktodd;2018-01-26 11:18;0;3;"I think *some* of what banks can do can easily be replaced by cryptocurrencies. Meanwhile, some of what banks can do can only be replaced by sufficiently strong AI that when it comes I for one want to welcome our robot overlords. As a trusted twitter personality...";;;;"956969644723703808";https://twitter.com/peterktodd/status/956969644723703808
peterktodd;2018-01-26 11:11;0;1;"You have a very low bar for "users in the know" if you're claiming that... :) If anything, I find it annoying how ~all wallet software targets users with relatively little knowledge of Bitcoin.";;;;"956967789394366466";https://twitter.com/peterktodd/status/956967789394366466
peterktodd;2018-01-26 11:09;0;2;"...and don't assume the cryptocurrency community universally hates banks! I for example am mostly indifferent, think that banking comes in many different types, and am here to ensure people have privacy and freedom. That's often orthogonal to banking.";;;;"956967226648813568";https://twitter.com/peterktodd/status/956967226648813568
peterktodd;2018-01-26 11:05;0;0;"*Some* of the legitimate entities are, and in any case, that doesn't negate my point. :) I for example would be very dubious about being closely involved with any cryptocurrency exchange due to legal risks. I'll consult for them, but I'm staying off the board of directors.";;;;"956966409808089089";https://twitter.com/peterktodd/status/956966409808089089
peterktodd;2018-01-26 10:47;1;1;"Of course, some of this is simply structural: from what I've seen banking security is also pretty bad, but it's much harder to profit off of hacking a bank due to reversibility of transactions.";;;;"956961712904851456";https://twitter.com/peterktodd/status/956961712904851456
peterktodd;2018-01-26 10:45;0;4;"Notice how by contrast wallet software has been relatively free of these kinds of hacks and insider thefts: no-one is threatening wallet software providers with jail, so much more ethical people feel comfortable getting into that business.";;;;"956961309169537026";https://twitter.com/peterktodd/status/956961309169537026
peterktodd;2018-01-26 10:44;0;8;"Eh, the reason why this is true is probably *because* of AML/KYC regulations that scare off legit entities from getting into this space. If Bitcoin/cryptocurrencies were more clearly legal, we wouldn't be having these issues as much.";;;;"956961070492594176";https://twitter.com/peterktodd/status/956961070492594176
peterktodd;2018-01-26 10:40;0;18;"That looks shockingly useful.";;;;"956960014178177024";https://twitter.com/peterktodd/status/956960014178177024
peterktodd;2018-01-26 04:43;0;4;"By the first tweet I figured you'd eventually say something like that. :)";;;;"956870153643307008";https://twitter.com/peterktodd/status/956870153643307008
peterktodd;2018-01-26 03:18;1;28;"Looks like we found Satoshi. https:// twitter.com/jaycenhorton/s tatus/956679969245052928 …";;;;"956848740509286400";https://twitter.com/peterktodd/status/956848740509286400
peterktodd;2018-01-26 03:16;0;0;"Do you have a link to this prior discussion?";;;;"956848241492054016";https://twitter.com/peterktodd/status/956848241492054016
peterktodd;2018-01-26 03:14;0;1;"See even if Tether isn't a fraud, and really is 100% backed up by USD, theres a major risk that governments act against it and you don't get your USD back for years, if ever.";;;;"956847780512792576";https://twitter.com/peterktodd/status/956847780512792576
peterktodd;2018-01-26 03:01;0;0;"...and that's why I say "may indicate" <- your job as a savvy investor is to figure out the probabilities and more detailed scenarios.";;;;"956844650970714113";https://twitter.com/peterktodd/status/956844650970714113
