,date,title,1hr_change,2hr_change,6hr_change,12hr_change,24hr_change
1838,2017-08-28 13:00:45,"Just days after resigning from South Africa's central securities depository, its former CEO reveals plans to enter the blockchain space full-time.",-0.32236369118,0.303810385213,0.651221039449,1.52113917299,5.8700340917
1839,2017-08-28 14:30:19,The highest-ranking official at Banco de Mexico has stated that the central bank is unlikely to classify bitcoin as a currency.,0.628199162401,1.03234062355,1.79129827827,2.03862261517,6.59609120521
1840,2017-08-28 15:59:42,The U.K.'s central bank has warned that a shift to DLT could bring about both positive and unwelcome changes in the securities settlement industry.,0.40161849711,0.116069364162,1.12138728324,1.49063583815,5.43283236994
1841,2017-08-28 16:59:14,Blockchain data storage startup Bluzelle has raised $1.5 million in new funding from a trio of venture capital firms. ,-0.284406902222,-0.146694086409,0.981491673902,0.64388801507,4.95581905734
1842,2017-08-28 18:04:16,"Connecticut-based REX ETF wants to offer investors a way to short the bitcoin market, according to new SEC filings.",0.0917896678967,0.899215867159,0.97832103321,0.323339483395,5.82772140221
1843,2017-08-28 19:29:19,Vnesheconombank is partnering with the Russian government to establish a new blockchain and quantum computing research hub. ,0.806685745096,0.772353789649,0.864289697188,0.617975198042,5.80809128153
1844,2017-08-28 20:40:17,The SEC has a message for would-be investor in cryptocurrency companies with publicly traded stocks: watch out. ,-0.0340572207022,0.228571951022,0.242971983936,-0.465829636182,5.50241257694
1845,2017-08-28 23:38:14,"Investment in cryptocurrencies continues apace, with the market setting a notable new high today for total investment.",0.159214541595,0.137940184744,-0.00480388703088,1.45283269205,5.21839385468
1846,2017-08-29 09:00:09,Reports from China suggest regulators may be close to taking action against entrepreneurs seeking to launch domestic token sales.,0.396642735278,1.56458612437,4.4271924702,5.30956225024,3.77749533395
1847,2017-08-29 10:00:01,"When SegWit finally activated last week, the code change didn't immediately make its benefits possible. So, when can we expect to see some benefits?",1.16332912862,5.15149510603,3.95988111233,4.90491495152,3.8059110806
1848,2017-08-29 11:00:17,"Regulators in Luxembourg have released a warning about OneCoin, becoming the latest country to air concerns over the investment scheme.",3.94230400657,2.93215061207,3.04105777491,3.71163728278,3.16800339123
1849,2017-08-29 12:00:19,"In a CoinDesk exclusive, blockchain insurance consortium B3i outlines how its DLT prototype could ultimately eliminate brokers from the equation. ",-0.971840488003,-0.614125094093,-0.458153372916,0.168770513318,-0.754911807645
1850,2017-08-29 12:50:06,"The price of ethereum's ether token has risen sharply over the past 24 hours, reaching levels not seen for over two months.",-0.971840488003,-0.614125094093,-0.458153372916,0.168770513318,-0.754911807645
1851,2017-08-29 13:30:14,A new development in Russia hints at what a changing regulatory environment could bring for bitcoin users.,0.361225933788,-0.110405015542,0.592331670686,0.957938755884,-0.225191182495
1852,2017-08-29 14:30:11,A new tool showcases how the future of cryptocurrency trading might look with the introduction of cross-blockchain atomic swaps.,-0.469933427917,-0.522318018116,0.746916948598,0.579067990833,-0.169595110772
1853,2017-08-29 14:38:02,"The price of bitcoin is now trading at its highest level ever, according to data from the Bitcoin Price Index.",-0.469933427917,-0.522318018116,0.746916948598,0.579067990833,-0.169595110772
1854,2017-08-29 16:05:58,"Banco de la Republica Colombia, the South American nation's central bank, has officially joined the R3 distributed ledger consortium.",0.269222414576,0.682820011541,0.90903705264,1.31802693102,0.662414400657
1855,2017-08-29 17:15:34,Representatives from the People's Bank of China are now visiting the US in an attempt to get up to speed on blockchain tech and regulation.,0.412487089264,0.486012639392,0.650788649056,0.98865605798,0.208103565989
1856,2017-08-29 19:15:21,"Cryptocurrency startup Coinbase is receiving the lion's share of customer complaints filed with the US government, according to a new report.",0.51545605993,0.140460143073,0.363454230681,-0.0119772215024,-0.371511634237
1857,2017-08-29 21:35:25,A trio of notable blockchain funds including Polychain Capital and Pantera Capital are investing in a token sale for mobile messaging platform Kik. ,0.010873110797,0.0234859193215,0.440143525063,-1.45482222464,-0.383820811134
1858,2017-08-30 09:00:05,"Jimmy Song takes a look at developments on the bitcoin cash blockchain, arguing it's providing evidence of shifting miner behavior.",0.424132756642,0.968090740577,1.24282814017,1.08681260482,2.94862741637
1859,2017-08-30 10:01:00,Burger King meets blockchain as the fast-food chain's Russian branch is set to launch a new cryptocurrency-based loyalty program. ,0.5416606238,0.531552555364,0.811721843536,0.684711766231,3.27787080131
1860,2017-08-30 11:00:10,Recent commentary among developers hints at how bitcoin cash may seek to improve its technology and further its already large economic network.,-0.0100536119787,-0.453286766168,0.0848000314722,0.535682673037,2.67054532103
1861,2017-08-30 12:00:09,Citi's head of cash management for Asia-Pacific explains why state-issued currencies on a blockchain could supercharge the technology's potential. ,-0.443277719612,-0.0279780809222,-0.546665471769,0.852238574342,3.32086705821
1862,2017-08-30 13:00:29,Coinbase is moving ahead with its appeal of a court decision from earlier this summer related to the failed cryptocurrency exchange Cryptsy. ,0.417148766228,0.728693029005,0.444812315988,1.57813964823,3.25551679243
1863,2017-08-30 14:00:07,"After putting millions into Kik's ICO, the startup's investors are speaking out about their reasons for buying into the experimental token sale.",0.310250058486,0.306751819631,0.0933592494529,1.23050551738,2.87730145855
1864,2017-08-30 14:55:17,The non-profit that supports development of the ethereum protocol has inked a deal with a state-backed development bank in Russia.,0.310250058486,0.306751819631,0.0933592494529,1.23050551738,2.87730145855
1865,2017-08-30 16:00:04,A group of enthusiasts have launched a new website dedicated to connecting buyers and sellers of the privacy-focused cryptocurrency monero.,-0.183313861231,-0.823059619509,-0.125987409978,1.09421591365,3.27501874553
1866,2017-08-30 17:00:17,A UK-based blockchain startup backed by Jaguar Land Rover's venture arm is moving to build a platform for collecting transport data. ,-0.640920654678,-0.0952100188892,0.4505006169,0.675423367945,3.92260910391
1867,2017-08-30 18:05:12,BTC-e has released a new update about its relaunch plans weeks after it was the target of a US crackdown. ,0.549230769231,0.615384615385,1.40659340659,1.72461538462,3.89230769231
1868,2017-08-30 19:05:04,"AMD's new graphics card is already sold out, a development that comes as cryptocurrency miners seek the latest GPUs to power their mines.",0.0657924935355,0.128087711667,1.12830847718,0.962187895493,3.67235775379
1869,2017-08-30 20:00:02,Israeli regulators are studying whether to apply the country's existing securities laws to the initial coin offering (ICO) model. ,0.062254259502,0.0869375273045,1.13608562691,0.961118392311,3.54630843163
1870,2017-08-30 23:59:05,Utility Settlement Coin is moving into its third phase – building a kind of blockchain-based fiat testnet – with six new partners.,0.304783933843,0.578915560502,0.223914017017,2.12348749342,3.598059122
1871,2017-08-31 09:00:10,"An advisor to Russian President Vladimir Putin has announced a new association focused on blockchain and cryptocurrency, reports say.",0.745302472338,0.695358418253,1.54505039419,1.68223577881,2.88903845907
1872,2017-08-31 10:00:07,A blockchain task force within the European Parliament wants to explore how the technology could be used to provide digital identities to refugees.,-0.0495745735629,0.573405475331,0.808937891357,0.935108372571,2.59596297013
1873,2017-08-31 11:00:22,"The ICO market is powering new forms of startups, but how would they handle mergers and acquisitions? It may not be so easy.",0.623289041778,0.113886488166,1.30533073913,1.4439103724,3.39254011572
1874,2017-08-31 12:00:03,"Computer technology multinational Oracle has officially joined the Hyperledger project, the Linux Foundation-led blockchain development initiative.",-0.506247170474,-0.457166792893,0.00338485362625,0.994935412762,2.20375126403
1875,2017-08-31 13:30:01,"BitcoinIRA, a company that allows users to create retirement funds based on cryptocurrencies, is adding new options to its portfolio.",0.0493301098658,0.729107529008,0.850306505833,1.34934860866,2.54050065809
1876,2017-08-31 13:34:52,"Bitcoin prices are breaking above $4,700 again, just a day after the cryptocurrency's previous all-time high.",0.0493301098658,0.729107529008,0.850306505833,1.34934860866,2.54050065809
1877,2017-08-31 14:30:09,The creator of the first ever commercial fuel pump to accept bitcoin has revealed a plan to add Lightning Network functionality to his design.,0.679442249534,0.694531520637,0.744262357794,1.09089054328,2.85952313653
1878,2017-08-31 15:59:28,"With a shallow market for shorting bitcoin, a Chicago market data firm is bringing a new tool to U.S. retail investors. ",0.014987440103,0.457644649906,0.135098051633,-0.453845017204,1.96398792561
1879,2017-08-31 16:30:12,"Russian bank Vnesheconombank is shedding light on its work with ethereum creator, Vitalik Buterin, and pledging to retract past statements.",0.44259087676,-0.230265448997,0.125158030481,-0.37399667793,2.25685467105
1880,2017-08-31 17:00:19,"One of Russia's largest exchanges hasn't launched support for crypto products, but representatives say it is considering the idea.",-0.669891447327,-0.335786239909,0.136794018886,-0.565457303876,1.67094629521
1881,2017-08-31 18:00:49,A website for funding initial coin offerings (ICOs) in China has suspended its services amid reports that regulators may impose new curbs.,0.336358443866,0.280298703222,0.991516997736,0.334454528146,3.06170802395
1882,2017-08-31 20:15:14,"Controversial scaling proposal, Segwit2x has lost Chinese mining pool, F2Pool's support over its timeline for a 2MB hard fork. ",0.0706698872446,0.0757328045397,0.344067421182,1.11088843651,2.73481915892
1883,2017-08-31 21:01:07,"A new web portal for the troubled bitcoin exchange BTC-e has been launched, allowing users to access and check their balances. ",0.00505934186394,0.459346080064,-0.588148491684,1.18683727892,3.17494782554
1884,2017-08-31 21:28:32,"The price of bitcoin has risen above $4,800 for the first time, market data reveals. ",0.00505934186394,0.459346080064,-0.588148491684,1.18683727892,3.17494782554
1885,2017-08-31 23:00:13,Illinois' state government has launched a new blockchain pilot focused on the digitization of new birth certificates. ,0.177946024438,0.0205645169752,-0.701291997255,1.92089375909,3.48904309945
1886,2017-09-01 09:00:54,"An ethereum-based microfinance startup has become the latest to close a successful ICO, raising $26 million in ether and bitcoin in its token sale. ",0.458333333333,1.188125,0.632083333333,1.96479166667,-1.05291666667
1887,2017-09-01 10:00:14,"A U.S. federal agency has awarded a $100,000 grant to a research group in Arizona looking to apply blockchain to public library systems.",0.726462048942,0.188925756947,0.475736209042,2.61281625881,-1.47967648279
1888,2017-09-01 11:01:07,"Gains have been made across many of the top cryptocurrencies today, with litecoin achieving a new all-time high.",-0.533659458558,-0.71113417047,-0.381508864471,1.53859457323,-3.17725029493
1889,2017-09-01 12:00:25,Interest in crypto mining has boosted the revenue of GPU makers at a time that's traditionally their slowest. But some fear the boom won't last. ,-0.178426903962,0.181531780481,0.842870479041,2.81943487108,-2.63107236225
1890,2017-09-01 12:40:18,"Having briefly topped the $4,800 mark for the first time yesterday, bitcoin's price has bounced back to achieve a new high of almost $4,880 today.",-0.178426903962,0.181531780481,0.842870479041,2.81943487108,-2.63107236225
1891,2017-09-01 13:30:13,"Tech giant Microsoft has joined the Initiative for Cryptocurrencies and Contracts (IC3) research effort, it was announced today.",0.360602095598,0.162778979324,1.26905395346,1.92224348832,-4.61359173373
1892,2017-09-01 14:30:57,An organization representing the interests of online finance firms in China has issued a warning on initial coin offerings.,-0.197112325099,0.104548046646,0.62212286255,-0.192360141161,-4.14679702803
1893,2017-09-01 16:15:09,Researchers in India supported by the country's central bank are planning to launch a new blockchain platform this year. ,-0.132922182731,0.555012033173,2.1269613246,-4.47539082011,-3.50757697722
1894,2017-09-01 18:05:35,A new paper suggests bitcoin mining may naturally resist centralization – a finding with potential implications for the long simmering scaling…,0.24344034993,-0.0377681487244,1.96004376179,-2.09223228233,-4.55331979975
1895,2017-09-01 20:25:38,"Russia may have a finalized cryptocurrency trading bill by the end of the summer, according to a senior lawmaker. ",0.499385009004,1.60164599927,-0.809447247325,-3.51273821917,-6.67434635389
1896,2017-09-01 21:45:13,BTC-e has posted a new update claiming that funds withdrawals will be activated starting tomorrow. ,1.09678381631,0.765174253368,-0.905132694905,-2.95955916156,-7.01426758828
1897,2017-09-02 05:05:04,"Bitcoin markets rose above $5,000 for the first time after a week of rising prices.",0.0377508860972,-0.387156309641,-1.37140580105,-2.84851408318,-2.05784274659
1898,2017-09-02 13:40:23,A look at the applications using Blockstack's platform give insight into what kind of future the startup is looking to cultivate. ,0.851739130435,0.521739130435,-0.139782608696,1.54608695652,-0.575869565217
1899,2017-09-02 14:20:16,The cryptocurrency asset class saw a broad sell-off on Saturday after bitcoin passed a notable milestone in its price history.,-0.327212998849,0.772119210723,-2.03117792368,0.614332705349,-0.698830396751
1900,2017-09-02 14:45:08,Reports from anonymous sources in China indicate the country's top financial regulator may be close to cracking down on initial coin offerings.,-0.327212998849,0.772119210723,-2.03117792368,0.614332705349,-0.698830396751
1901,2017-09-03 14:50:45,"Bitcoin Core developer, Alex Morcos has been working for years to make sure bitcoin transaction fee estimation tools are smarter. ",0.298691488161,0.363161961986,0.0701143536889,-0.441090918563,-5.53946808603
1902,2017-09-03 15:50:10,One bullish bitcoin investor believes this weekend's cryptocurrency market decline means conditions are ripe for buyers.,0.0642784794785,-1.27777825872,-0.362080458477,-0.91418281925,-5.73550163185
1903,2017-09-04 09:00:54,"How financial firms in the Netherlands are approaching blockchain, and how trends in the technology are shaping their work and progress.",-1.76328072905,-0.340297843965,-3.18937541676,0.154478773061,-2.2011558124
1904,2017-09-04 10:31:04,"Just two days after achieving a historic high of over $5,000 on September 2, bitcoin's price has plummeted to below $4,400.",1.44852443734,1.81733025316,-3.89169327122,1.77796079798,0.582622684499
1905,2017-09-04 12:00:17,A former central bank technologist takes a look at why central banks might consider issuing cryptocurrency – and the possible implications.,-4.44000986669,-3.29822955162,0.222444938767,-5.66045702324,-1.33355851902
1906,2017-09-04 13:15:56,"Following in Floyd Mayweather's footsteps, Paris Hilton has announced her participation in a token sale for a project called called Lydian.",1.19483092608,1.28645478456,5.11186715006,1.04204697932,2.4438455045
1907,2017-09-04 13:40:06,New statements from China's financial regulators call for a halt on all token trading and for the commencement of customer refunds.,1.19483092608,1.28645478456,5.11186715006,1.04204697932,2.4438455045
1908,2017-09-04 14:10:03,"China-based mining firm Bitmain is to receive a $50 million investment from major venture capital firms, according to a report.",0.0905420342543,-2.38764399975,3.87951934589,-1.32320059197,0.28426521922
1909,2017-09-04 15:01:02,"The price of bitcoin may have seen a notable decline today on news that China was taking action to outlaw ICOs, overall trends are bullish.",-2.4759442637,0.762712058978,3.45401571802,-0.241303544246,0.791870527217
1910,2017-09-05 03:30:27,"The price of bitcoin continued its downward trajectory late Monday, falling $1,000 from its most recent all-time high set Friday.",-1.43176064442,-0.253394706559,1.26513233602,1.03567318757,2.40713463751
1911,2017-09-05 05:10:03,ICO platforms in China are reportedly now issuing refunds to select customers following warnings by the nation's regulators on Monday.,2.21481821601,1.08445104857,2.08952950976,2.3075733908,4.29188807542
1912,2017-09-05 09:00:15,Brazil's central bank is seeking to investigate possible use cases for blockchain tech and is now moving toward prototyping. ,1.03296158837,0.558640172547,-0.226592454039,2.01796830433,5.93231317486
1913,2017-09-05 10:00:10,"Xerox may be looking to use blockchain to create digital proofs for documents and other forms of data, according to a patent filing.",-0.469471950907,-0.122373139096,-0.863360492372,-0.29041125473,5.27644182102
1914,2017-09-05 11:00:28,Confused by token terminology? You're not alone. Even some of the brightest minds in the space agree there's reason for confusion.,0.348736029653,-0.435524516618,0.21358104214,1.2315376705,5.77301646495
1915,2017-09-05 12:00:02,The IRS has submitted new arguments in its tax investigation dispute with cryptocurrency exchange startup Coinbase. ,-0.78153505196,-1.71262032712,0.675903945513,1.92636002865,3.60316938365
1916,2017-09-05 13:00:28,"The Hong Kong securities regulator, the SFC, has announced that tokens issued via initial coin offerings may be classified as securities.",-0.938419351324,-0.346856499473,1.17540769259,1.94811680529,4.40630334508
1917,2017-09-05 14:00:06,CoinDesk provides a translation of yesterday's ruling from China's regulators on the legality of fundraising via blockchain tokens.,0.597166780478,0.987639610077,1.64782283899,3.4209911227,7.09381888844
1918,2017-09-05 15:05:04,The price of ether appears to have stabilized following moves by China's regulators to curb one of its biggest use cases.,0.388154897494,1.00227790433,2.24965831435,1.35740318907,5.25307517084
1919,2017-09-05 16:35:31,"The Bank of Russia, the country's central bank, has issued a new statement on the risks of cryptocurrencies and initial coin offerings. ",0.611748475167,1.42839638397,0.577938934069,1.88788846936,5.64846246006
1920,2017-09-05 17:40:48,"The Internet Archive, the nonprofit dedicated to providing ""open access to all knowledge,"" has spoken out on why it accepts bitcoin donations.",0.811682453766,0.520072169599,1.01578709968,1.93955796121,4.18651330627
1921,2017-09-05 19:05:11,"Canada's financial intelligence agency has concerns over the anonymity of blockchain technologies, a report says.",-0.475874230995,0.711231170323,0.763732146303,4.49758360893,2.51713012614
1922,2017-09-05 21:00:15,"BTC-e launched a refund option this weekend, but tech problems and scam attempts have complicated the situation.",-1.25313004037,-0.216540870976,-0.872624065443,3.8369170996,2.83240805924
1923,2017-09-05 23:59:21,A notable UK celebrity is launching a new real estate venture – one that is targeting cryptocurrency investors in its marketing and branding.,1.03749910695,0.269254125884,0.914481674645,4.48622919197,1.80753018504
1924,2017-09-06 04:55:14,"Cryptocurrency prices rebounded heading into Wednesday, a trend that suggests China's move to ban ICOs may have a limited impact.",0.662770809578,2.2885190992,4.22560932155,3.69089402794,1.67518885405
1925,2017-09-06 09:00:17,"An ICO startup has been accepted into Quebec's regulatory sandbox, demonstrating how regulators there want to accommodate the burgeoning industry. ",0.407424173834,0.407424173834,-0.866339554472,-0.967391047825,-1.3085202929
1926,2017-09-06 10:00:08,The U.S. General Services Administration is bullish about a blockchain proof-of-concept aimed to streamline the IT procurement bidding process. ,0.0,-1.70983636682,-0.513036380497,-1.36325368912,-1.19402219668
1927,2017-09-06 11:00:30,Both new and founding members of the Utility Settlement Coin project think its work could lead central banks to adopt blockchain-based fiat currency. ,-1.70983636682,-1.72201590605,-1.28953542537,-2.5636861696,-0.64060102821
1928,2017-09-06 12:06:04,"A joint venture between shipping giant Maersk, Microsoft and accounting firm EY aims to apply blockchain technology in the field of marine insurance.",-0.0123914120992,1.59892694719,0.463699684345,-1.91436447273,1.30522874112
1929,2017-09-06 13:00:17,An official with the US Securities and Exchange Commission addressed ICOs in off-the-cuff remarks at an event this week.,1.61151804913,0.461365528907,-0.655304290352,-1.35909327106,0.883160593035
1930,2017-09-06 13:30:28,"A test network has been deployed for the Raiden project, a proposed extension to ethereum designed to allow faster payments and lower fees.",1.61151804913,0.461365528907,-0.655304290352,-1.35909327106,0.883160593035
1931,2017-09-06 14:08:10,"CoinDesk is releasing its latest State of Blockchain report, one that retraces what was a historic quarter for the emerging industry.",-1.13191156112,-0.375306782269,-1.70107692077,-3.12484620767,-0.445489578497
1932,2017-09-06 15:00:09,"After setting a new all-time high on strong technology improvements, the outlook looks positive for litecoin, the fifth-largest cryptocurrency.",0.765266923631,-0.0212093208472,-0.101934593052,-1.46430882503,0.203219921179
1933,2017-09-06 16:00:17,The Indian state of Andhra Pradesh has announced a new partnership with cybersecurity firm WISeKey to secure citizen data with blockchain tech.,-0.780503310803,-0.744850160117,-0.854601726386,-1.94395582446,-0.667315296276
1934,2017-09-06 16:40:11,"The Bank of Japan and the ECB have said that blockchain technology is too ""immature"" to replace their real-time settlement systems. ",-0.780503310803,-0.744850160117,-0.854601726386,-1.94395582446,-0.667315296276
1935,2017-09-06 18:00:20,China has banned ICOs – and the country's exchanges are quickly moving to adapt to the new reality. ,-1.12609249798,-0.590311363277,-2.3670879776,-2.84119802047,-0.0926148326549
1936,2017-09-06 21:15:26,The Isle of Man is opening its doors to legally complaint ICOs. ,0.00606598929788,-1.21103143482,-1.36376437964,-0.344461535129,0.217509044823
1937,2017-09-07 09:00:02,Ethereum creator Vitalik Buterin has finally begun formalizing his vision for proof-of-stake in a series of long-awaited white papers. ,0.523913043478,1.08695652174,0.652173913043,0.563913043478,0.745
1938,2017-09-07 10:00:03,Israel's largest bank is working with software giant Microsoft to develop a blockchain-based platform for creating digital bank guarantees.,0.560108994183,0.776367293095,0.017300663913,0.0017300663913,0.2982201942
1939,2017-09-07 11:00:12,A Russian political group formed by President Vladimir Putin is planning to advance a green-friendly cryptocurrency concept.,0.215053763441,-0.214838709677,-0.860215053763,-0.868602150538,-0.206021505376
1940,2017-09-07 12:00:05,"Ukraine's justice ministry has begun testing the use of a blockchain to digitally auction seized assets, according to a report.",-0.428969957082,-0.15686695279,-0.922532188841,-1.28755364807,-4.07575107296
1941,2017-09-07 13:00:29,Is the market for ICOs maturing? Protos' recent announcement of a security token shows an institutional investor market ready to play by the books. ,0.273275273114,-0.21573229368,-1.39072976136,-0.582326331193,-5.5389966832
1942,2017-09-07 14:00:12,"Users of cloud-based accountancy platform Xero can now send payments via the blockchain, thanks to an integration with Veem.",-0.487674871956,-0.597288880196,-0.873903053932,-0.702604299878,-4.67879871644
1943,2017-09-07 14:20:36,Though the price of bitcoin may appear to be heading back toward all-time highs – technical indicators suggest appearances may be deceiving. ,-0.487674871956,-0.597288880196,-0.873903053932,-0.702604299878,-4.67879871644
1944,2017-09-07 15:45:42,"ConsenSys, the ethereum-based blockchain development firm, has announced a $50 million venture capital fund for startups working with the technology.",-0.110151187905,-0.431965442765,-0.0876889848812,-0.972570194384,-4.61879049676
1945,2017-09-07 16:45:46,"The price of ether is seeking direction, but where are they headed from here? A look at the charts may leave more questions than answers.",-0.322169127981,-0.170598283206,-0.0155679041709,-0.278924949729,-6.26067590651
1946,2017-09-07 18:00:06,Massachuetts-based digital identity startup Cambridge Blockchain is opening a new office in Paris. ,-0.899499892788,-0.107862014594,-0.368420254667,0.606236503711,-8.98936757772
1947,2017-09-07 19:00:47,A new bill has been introduced in the US Congress that would create a tax exemption for some purchases made with cryptocurrency.,0.798823292857,1.10283511238,0.819804698086,2.28413193807,-7.11378915436
1948,2017-09-07 20:45:08,"Filecoin's initial coin offering has ended, raising more than $257 million over a weeks-long token sale. ",0.301602548119,0.263441478048,0.172808936629,1.03685361977,-8.75796558132
1949,2017-09-07 21:50:35,"Blockchain, the provider of the world's most popular bitcoin wallet, has partnered with Indian cryptocurrency exchange Unocoin.",-0.0380463213963,-0.353009334319,-0.885657833867,0.18007150979,-6.0584443378
