,date,title,1hr_change,2hr_change,6hr_change,12hr_change,24hr_change
926,2017-05-09 19:15:06,"The president of the Federal Reserve of Minneapolis took aim at bitcoin today, criticizing the ease at which new cryptocurrencies can be created.",-0.788839510168,0.56576841059,0.612000762834,0.964522448697,3.10970359283
927,2017-05-09 20:15:20,"Hungary's government has set its sights on OneCoin, a digital currency investment scheme widely believed to be fraudulent.",1.36537856635,0.214942274311,-0.622691846174,1.19703624311,3.80139100854
928,2017-05-10 10:00:05,Bitcoin peer-to-peer lending market Bitbond has secured €5m worth of debt financing to fund loans on the platform.,0.683190883191,1.44273504274,1.53333333333,2.27863247863,6.42393162393
929,2017-05-10 11:00:08,"The value of ethereum's ether token has jumped by about 900% since the start of the year, but there is a downside to that success.",0.75439023424,1.63158818103,1.18676393188,0.787214415475,4.69781945568
930,2017-05-10 12:00:18,China-based Canaan Creative has raised $43m in a Series A round – the largest ever for a bitcoin mining business.,0.870629999101,0.824009166891,-0.132560438573,0.293205715826,4.11105868608
931,2017-05-10 13:15:10,A new Hyperledger digital ID project opens up about its design and the desire to create better alternatives to systems in use today.,-0.0462184406009,-0.325756478934,-0.647058168413,-0.388123531312,3.18127651992
932,2017-05-10 14:45:21,Online travel company Webjet has been testing an etherum blockchain pilot to make sure middlemen get paid for their services.,-0.279667296197,-0.728694867381,-0.723680911871,0.0295266268893,3.60670532983
933,2017-05-10 15:45:16,A new paper from the research arm of the European Parliament examines the relationship between blockchain and a shift in Europe's social values.,-0.450286876316,-0.112292384789,-0.391626675307,1.80505818533,4.18554500913
934,2017-05-10 17:20:06,The French government has convened a new working group focused on blockchain.,-0.55929662856,-0.210295532339,-0.394863419763,2.91057965503,3.46931698696
935,2017-05-10 18:00:07,"The litecoin network has officially upgraded its code to support Segregated Witness, enabling users to send news kinds of transactions today.",0.350964026187,0.227226709262,0.426331301042,5.604175572,3.82629530473
936,2017-05-10 19:15:10,Regional prosecutors in Germany are investigating a payment processor connected to OneCoin.,-0.123304562269,-0.069498935097,0.260621006614,4.63905391772,2.28001345141
937,2017-05-10 20:25:15,"Services remain halted on digital currency exchange Celery, a week after the freeze was first announced.",0.0538720538721,0.728956228956,0.758698092031,5.55050505051,2.91694725028
938,2017-05-11 10:00:27,The People's Bank of China shares new research into how a digital currency economy could coexist with central banks.,-0.949811001531,-0.761883345648,-0.533264801311,-1.59604655894,-2.7129043657
939,2017-05-11 11:00:13,"Dave Carlson, founder of bitcoin mining enterprise MegaBigPower, is riding the ICO wave and selling tokens to access his latest mining venture.",0.18972972973,0.159459459459,-0.00054054054054,-1.09567567568,-2.46054054054
940,2017-05-11 11:25:04,"Bitcoin's price rose above $1,800 this morning, setting a new all-time high just over a day since passing the $1,700 mark.",0.18972972973,0.159459459459,-0.00054054054054,-1.09567567568,-2.46054054054
941,2017-05-11 12:30:14,Intel has unveiled a digital asset exchange proof-of-concept tied to its Sawtooth Lake distributed ledger project.,-0.030212947327,0.335579522096,-0.405716721248,-1.32289547939,-4.02048006215
942,2017-05-11 13:30:10,Five venture capitalists react to the rising popularity of initial coin offerings and how it is impacting their investment strategies.,0.365903019509,0.644377883915,-1.51488167517,-1.78418198009,-4.00010793599
943,2017-05-11 14:15:47,Digital currency payments processor Coinify has inked a new deal with point-of-sale provider Countr that will bring more options for bitcoin spenders.,0.277459631237,-0.104853930409,-1.38460959387,-3.26122609196,-5.78148440903
944,2017-05-11 14:55:35,"Global financial institution Citi has invested in distributed ledger startup Axoni, the company announced today.",0.277459631237,-0.104853930409,-1.38460959387,-3.26122609196,-5.78148440903
945,2017-05-11 16:17:49,The United Nations agency dedicated to fighting drug trafficking and organized crime has developed a new cryptocurrency training program.,-0.419317680242,-0.634628427478,-1.06847958316,-5.13408476784,-5.24012531085
946,2017-05-11 17:21:22,A major securities market maker is linking up with a blockchain startup focused on post-trade currency settlement.,-0.216217384959,-1.35730463408,-1.09514105482,-3.29785566408,-6.33841264007
947,2017-05-11 18:34:45,The Federal Bureau of Investigation's work is being hampered by the criminal use of virtual currencies.,-1.14355982427,-0.650599407364,-0.920915064545,-3.0872323252,-9.84783232845
948,2017-05-12 10:00:07,An event held yesterday at the European Parliament showcased the state of the blockchain conversation in the EU.,-0.692873692263,-2.09568150924,-3.11710611039,-6.68438750296,-4.48854474511
949,2017-05-12 11:00:13,HM Land Registry has revealed it is looking to test blockchain as part of a digitization effort called 'Digital Street'.,-1.41259531832,-1.42146213868,-3.97621475439,-6.4567077496,-4.01777797482
950,2017-05-12 12:00:40,PayPal accepting bitcoin? The story behind the headlines that made the mainstream public take notice of the upstart digital currency.,-0.00899386730673,-1.50534854046,-6.45253767587,-7.81342222272,-2.58629896739
951,2017-05-12 13:00:38,One of bitcoin's most prolific developers is attempting to make bitcoin addresses more user-friendly.,-1.49648926542,-0.779163832407,-5.31360501003,-7.90182310845,-4.46248376742
952,2017-05-12 14:41:36,"Bitcoin prices slid this morning, a day after crossing the $1,800 mark according to the CoinDesk Bitcoin Price Index (BPI).",0.728223215254,0.469121851833,-2.02315932451,-5.37663864491,-2.2982405077
953,2017-05-12 15:50:15,The US government has awarded research contracts to three startups working with blockchain worth a total of about $2.25m.,-0.257228168184,-1.82665994323,-1.62155730692,-4.83237675428,-2.90543182037
954,2017-05-12 17:05:08,Palestine's monetary authority is reportedly looking to create its own digital currency.,-3.955030501,-2.79443421653,-2.583206847,-1.89469796218,0.130430015063
955,2017-05-12 18:30:13,Members of the ethereum development community ConsenSys have unveiled a new peer-to-peer exchange protocol.,1.20838841485,3.15827424588,-1.45475303449,1.99254897248,4.19420742699
956,2017-05-12 20:25:20,"Bitcoin's price took a dip today, falling more than $100 at points in what was one of its worst days in recent weeks.",1.14110300799,-1.23197185396,-3.42272653137,0.768307742492,3.3802045714
957,2017-05-12 22:20:56,Multiple outlets are reporting a wave of ransomware attacks affecting the UK’s National Health Service as well as other firms throughout the world.,-0.450575309181,-3.2802354315,1.31810970683,2.35313544978,5.72773220257
958,2017-05-13 10:25:12,An ethereum project aimed at decentralizing the domain space is winning enthusiasm – and investment dollars – from crypto investors.,-0.203398424671,-0.145778474339,-0.22068440977,3.29701355797,3.69747221278
959,2017-05-13 11:00:45,"Researcher Paul Ennis sheds light on China's bitcoin mining community, often viewed as one important political faction in the scaling debate.",0.0577373872678,-1.87819720782,0.173789535676,4.21598401829,4.06528943752
960,2017-05-14 12:30:41,A less risky way for bitcoin exposure? New IRA products are hitting the market aiming at general market consumers.,0.0532153725908,-1.069296393,-1.61530828885,-0.558761412203,-2.99281038143
961,2017-05-14 13:15:26,"Can this radical new technology, blockchain, create the underpinning of a safer, fairer and more prosperous society?",-1.12191473448,-1.80503615059,-0.336851436328,-1.04989057869,-4.0976204327
962,2017-05-15 10:00:22,Can we regulate blockchain before its uses are known? CoinDesk's Noelle Acheson discusses the difficult dynamics being examined by regulators.,-0.658498713604,-0.82850698734,-1.90522605433,-0.952613027167,-1.39066767916
963,2017-05-15 11:00:05,A major digital identity firm backed by the government of Luxembourg is building a new platform alongside US startup Cambridge Blockchain.,-0.171135196805,-1.2555618939,-1.6873930405,-1.10154021677,-0.172276098118
964,2017-05-15 11:30:07,"In an exclusive interview, Bank of Japan's Yuko Kawai discussed how blockchain is emerging as one of the ""hottest topics"" among central banks.",-0.171135196805,-1.2555618939,-1.6873930405,-1.10154021677,-0.172276098118
965,2017-05-15 13:00:13,"In a new interview, Germany's former Minister of Defense sounds off on why he believes blockchain tech is a safe long-term bet.",-0.155402399783,0.177355155142,-0.288274340118,-0.138648981219,1.64472353971
966,2017-05-15 14:00:06,"Amid scaling battles and upgrade standstills, bitcoin's price continues to rise. So what's causing all the momentum? ",0.333275473008,0.156222877973,0.907828501996,-1.07273042875,2.2964763062
967,2017-05-15 14:41:21,Two of Ireland’s ‘Big Four’ banks are taking part in a blockchain payments trial organized by professional services firm Deloitte.,0.333275473008,0.156222877973,0.907828501996,-1.07273042875,2.2964763062
968,2017-05-15 16:29:48,The head of the European Stability Mechanism has suggested that the organization could run via blockchain in the future.,-0.437897169266,-0.751010976314,0.971114962449,-1.22414789139,2.54072790295
969,2017-05-15 18:20:08,US immigration services are actively weighing the question of whether bitcoin can be used to pay for obligations tied to a controversial visa program.,0.46565774156,1.51280558789,1.12514551804,-0.217112922002,2.92083818393
970,2017-05-15 20:10:26,An internet-only bank based in Norway has integrated with digital currency exchange startup Coinbase.,0.877872006147,0.219037953199,-1.96274061204,-0.745990516001,0.90310150861
971,2017-05-15 23:16:23,"The price of bitcoin fell to around 10% below its most recent all-time high as the market experienced what analysts called a ""healthy correction"".",0.209956797351,-0.294170238047,-0.796566860281,0.939614348586,2.32452168496
972,2017-05-16 01:40:25,"Institutional investor Boost VC is formally opening its doors to so-called ICOs, becoming the latest big venture firm to back the concept.",-1.08932713946,-0.380657067321,-0.0919824828328,1.78584858179,2.85434949872
973,2017-05-16 10:00:35,Russian payments firm Qiwi has reportedly acquired a blockchain startup as part of its plan to offer services integrating the technology.,0.56893935911,0.727552756195,2.00565491242,2.14932646775,4.55266424532
974,2017-05-16 11:00:16,A new startup is seeking to fight the phenomenon of fake news using an ethereum-based blockchain platform.,0.157716088184,0.541720476805,0.727436884993,1.37201568018,4.50005142916
975,2017-05-16 12:30:36,"Led by the large tech companies, Financial Innovation Now hopes to lobby Congress into setting up unified federal money transmission rules. ",0.383399705604,0.870066296199,0.880906466447,0.251606056802,4.74970617433
976,2017-05-16 13:30:04,Blogger Jegar Pitchforth envisions how one summer entertainment staple – the theme park – could adapt to the advent of blockchain tech.,0.484807838769,0.753071965262,0.495606606572,1.04975390177,4.29165766769
977,2017-05-16 14:15:24,A New York-based broker-dealer has asked the Securities and Exchange Commission to propose rules for blockchain-based assets.,0.266969835802,0.395364227173,-0.466631598595,2.3218457118,3.7766050713
978,2017-05-16 14:40:19,"A US Congressional subcommittee is developing a bill to study the use of digital currencies by terrorists, CoinDesk has learned.",0.266969835802,0.395364227173,-0.466631598595,2.3218457118,3.7766050713
979,2017-05-16 17:00:19,"Reacting to concerns that Ripple might flood the market with billions in XRP, the company will voluntarily put the funds behind clock and key.",0.310317635913,0.310317635913,0.639923753766,3.68807120854,3.5127729462
980,2017-05-16 17:42:53,A subsidiary of South Korean conglomerate SK Group has launched a new blockchain service focused on trade logistics.,0.310317635913,0.310317635913,0.639923753766,3.68807120854,3.5127729462
981,2017-05-16 20:30:34,"Two unnamed Coinbase customers are seeking to stop the IRS from obtaining records on the digital currency exchange's user base, court records show.",0.24264948231,1.00810346983,2.80155022901,4.39042131224,2.31909259322
982,2017-05-16 22:00:09,"Ripple's native cryptocurrency XRP extended gains today, rising to fresh all-time highs amid what has been a torrid period of price growth.",-0.196345387852,-1.14375407881,2.95474491977,2.35276908882,2.01127438846
983,2017-05-17 05:00:48,Chile's Santiago Stock Exchange is going live with a new blockchain project it aims to grow into a powerful cost-cutting tool.,-0.207362178014,-0.428949729718,0.0552601054866,-0.169063095004,-0.205720788742
984,2017-05-17 10:00:06,Blockchain advocates are trying to recast the narrative surrounding bitcoin as recent upticks in ransomware trouble Capitol Hill. ,0.518331226296,0.917385807728,0.00879459132634,-0.333644808443,-0.149508052548
985,2017-05-17 11:00:10,Bitcoin wallet provider Xapo has told its customers that they will soon have to pay the network fees for outbound transactions.,0.396996822932,0.341220409793,-0.224199307716,-0.960776057701,-0.577996751844
986,2017-05-17 12:30:06,A new tool from Cornell's famed IC3 lab allows ethereum smart contracts to obtain and send information more securely.,-0.0555558581474,-0.0669938289424,-0.760352725233,-1.18900429741,-0.33660314054
987,2017-05-17 13:40:08,"A US think tank that advises the US government is exploring the threats bitcoin poses to national security, but also its benefits.",-0.0114443287901,-0.0583115800258,-1.25179158242,-1.20601426726,0.818541992512
988,2017-05-17 14:30:12,The latest blockchain trade finance trial in India showcases how the use case is now gaining global interest among enterprises.,-0.0468726154919,-0.833896531426,-1.86454904184,-1.54788637206,1.04427827073
989,2017-05-17 16:33:33,"The price of bitcoin is once again above $1,800 following a recent uptick that comes amid increasing exchange competition.",0.28415024238,0.141250700757,-0.342409286272,-0.0544117485408,2.2341793719
990,2017-05-17 20:32:37,"The CFTC is stepping up action on fintech, a strategy that includes a new plan of action for its work on distributed ledger tech.",0.830301852212,0.704229263281,0.322679181361,0.449862542001,4.41309599844
991,2017-05-17 23:45:14,"As Bitfinex's banking challenges fade, the spread between prices observed on its order books and others internationally is falling.",0.165639700523,0.0927582322931,0.7067293889,0.386492634555,5.69193224232
992,2017-05-18 10:00:58,"Ready for Consensus? Here's a sneak preview of our upcoming startup competition offering $10,000 in prize money.",0.0869766264079,0.728291624922,2.39626110603,4.54590494225,7.11722027106
993,2017-05-18 12:00:20,Bitcoins amassed by those behind the huge malware attack are being watched by the authorities. Can they retrieve the funds and not get caught? ,1.10284674365,1.3176231412,1.92315049103,3.95614845257,6.83677540291
994,2017-05-18 12:59:35,"0x OTC, an early stage platform for exchanging ethereum-based tokens, is expected to start settling trades today.",1.10284674365,1.3176231412,1.92315049103,3.95614845257,6.83677540291
995,2017-05-18 14:00:11,"Bitcoin software wallet startup Blockchain added two new executive hires this week, amid a continued buildup of expertise on its team.",0.66777422974,0.33388711487,1.40728834038,3.49044187451,5.56011046863
996,2017-05-18 14:59:59,"Global tech giant IBM is unveiling a new blockchain services package today, one that finds it seeking to jumpstart global use of the technology.",0.66777422974,0.33388711487,1.40728834038,3.49044187451,5.56011046863
997,2017-05-18 19:00:16,Microsoft has unveiled a new framework aimed at streamlining the blockchain proof-of-concept process.,0.336231327153,1.32090878524,1.42658148806,2.75496208058,3.51228311745
998,2017-05-18 20:45:07,Congressional leaders want answers about the Internal Revenue Service's ongoing effort to obtain user records from Coinbase.,0.981377758629,1.01861160313,2.05424439232,3.13774926729,4.86539965213
999,2017-05-18 22:45:10,"The total market cap of all cryptocurrencies reached an all-time high today, as these innovative assets continue to draw robust inflows. ",0.794561806272,0.160070768129,1.73971650624,2.45950841425,4.05810990122
1000,2017-05-19 01:41:00,"Bitcoin's price has nearly doubled so far in 2017, rising from $1,000 at the end of last year to a new all-time high of $1,900 today.",0.957146766012,1.32127296837,1.30969670182,3.39710803814,4.70890951569
1001,2017-05-19 10:00:54,A new roadmap unveiled this week showcases that the team developing the litecoin blockchain has big plans ahead.,0.519561944015,0.464573686834,-0.456351143704,1.56022755888,1.95902090068
1002,2017-05-19 12:00:33,"Bitcoin developers discuss a messy divorce with former maintainer Gavin Andresen, once the most public face of the digital currency project.",0.516136292719,0.106910292545,-0.821009662849,1.69266104322,1.98934989335
1003,2017-05-19 13:48:46,Moscow Exchange Group is working on a blockchain solution using Hyperledger Fabric that it hopes will increase trust from the international community.,-0.407124681934,-1.2941475827,-1.29669211196,1.26870229008,1.52519083969
1004,2017-05-19 22:15:05,"Bitcoin prices neared $2,000, but they failed to break through this key level. ",0.424545725953,0.595578449877,0.893114667827,0.392666845458,4.18372355444
1005,2017-05-20 14:40:07,"Sweltering, crowded, and filled to capacity. If there were a sign that blockchain may be overhyped, or that the industry is in the midst of a massive…",0.0923537147274,0.734814338918,2.74049610006,3.8191272574,1.98560486664
1006,2017-05-20 17:07:36,"Bitcoin mining hardware firm Canaan has acquired document timestamping service Proof of Existence, taking on its developer-creator as an advisor.",0.773080925715,1.19431091729,1.7344764359,2.97190148174,1.57044452153
1007,2017-05-20 18:34:59,Vinny Lingham launched a new product at Consensus 2017 today – unveiling the second service for his blockchain ID startup Civic.,0.417998524711,0.660929432014,1.00860585198,1.34300467175,0.51536759282
1008,2017-05-20 19:50:30,"Bitcoin prices passed $2,000 for the first time ever on the CoinDesk Bitcoin Price Index (BPI), climbing more than 100% since the start of the year.",0.241919686582,0.391283055828,0.714985308521,1.26591576885,-0.0984329089128
1009,2017-05-20 22:55:24,While much of the concern over token sales has fallen on securities laws – there's another set of regulations that could be equally impactful.,-0.291902025829,-0.23799000442,0.635773297522,1.0631839177,-0.0927675323351
1010,2017-05-21 13:40:53,"CoinDesk's Consensus 2017 Building Blocks hackathon is fast underway, with teams competing to realize the next big ideas for the emerging tech.",1.76800560954,1.45747771211,2.17319443053,4.45357107082,11.8897125113
1011,2017-05-21 22:11:23,The driving force behind one of Deloitte's most prominent blockchain initiatives is leaving the firm to pursue other projects.,1.31113271755,1.03159941663,5.95381623724,6.69518716578,3.222654351
1012,2017-05-22 00:01:22,"The Enterprise Ethereum Alliance has more than tripled in size, with the group announcing 86 new members today drawn from a wide range of…",0.351262137791,1.32372896036,4.53801811165,5.53261926071,4.01738025811
1013,2017-05-22 02:35:15,BlockBox won CoinDesk's Consensus 2017 hackathon for its bid to make drones and smart cars safer to operate with blockchain. Black boxes have long…,1.15304431242,3.50187345956,2.02495096712,7.32620041506,3.05167329145
1014,2017-05-22 07:00:25,The parent company of bitcoin options exchange operator LedgerX has raised $11.4m in a Series B funding round.,-1.08019504289,-0.529046932771,2.86210246658,0.282250452383,0.497276490333
1015,2017-05-22 10:00:33,"Skandiabanken customers can now link bitcoin holdings to bank accounts, a signal cryptocurrency is finding its place in the broader fintech arena. ",-0.308467594955,-0.0692571261938,3.88568929066,-3.25462929212,1.3919771087
1016,2017-05-22 12:00:42,"One of China’s top-funded blockchain startups, Juzhen Financials, is rebranding to reflect its planned expansion into new industries.",1.85983950392,3.04577785884,0.0291811052344,-1.43580156848,2.81780047419
1017,2017-05-22 12:20:24,Blockchain startup Libra has announced a new hire as it expands its suite of enterprise-focused auditing tools.,1.85983950392,3.04577785884,0.0291811052344,-1.43580156848,2.81780047419
1018,2017-05-22 13:00:03,"Bitcoin startup Blockstream’s first sidechain, dubbed Liquid, is launching in beta on the live bitcoin network.",1.16428453126,0.739036432571,-2.50806852314,-3.35185027686,1.98702769484
1019,2017-05-22 13:00:04,US firm Change Healthcare has joined the Linux Foundation-backed Hyperledger blockchain consortium.,1.16428453126,0.739036432571,-2.50806852314,-3.35185027686,1.98702769484
1020,2017-05-22 13:00:21,Digital currency exchange software provider AlphaPoint is expanding into the market for ICOs with a white-label toolkit.,1.16428453126,0.739036432571,-2.50806852314,-3.35185027686,1.98702769484
1021,2017-05-22 13:30:33,See a sneak preview of CoinDesk's 'State of Blockchain' from our Consensus 2017 conference.,1.16428453126,0.739036432571,-2.50806852314,-3.35185027686,1.98702769484
1022,2017-05-22 14:18:48,JPMorgan has partnered with the makers of zcash to provide a new layer of privacy to the users of its enterprise-grade blockchain.,-0.420353982301,0.884955752212,-5.25796460177,-3.98274336283,0.445132743363
1023,2017-05-22 14:54:20,Global financial institution Citi and stock exchange Nasdaq have partnered on a new blockchain payments initiative.,-0.420353982301,0.884955752212,-5.25796460177,-3.98274336283,0.445132743363
1024,2017-05-22 15:59:21,"Digital Currency Group is launching a fourth subsidiary, one that finds the investment company branching out into enterprise blockchain development.",1.31081981782,1.62141746279,-10.9962230615,-2.6500777605,-0.566985114419
1025,2017-05-22 16:15:58,Speakers during the opening panel of Consensus 2017 agreed that blockchain is set to go global – but differed on how the technology will get there.,0.306578947368,-3.77894736842,-6.87324561404,-3.07061403509,-1.67280701754
1026,2017-05-22 16:21:00,PwC Australia is partnering up with Alibaba and others on a trial that will find it seeking to provided added trust to the food supply chain.,0.306578947368,-3.77894736842,-6.87324561404,-3.07061403509,-1.67280701754
1027,2017-05-22 16:28:59,Blockchain technology is poised to recover billions of dollars lost to coordination costs in both capital markets and the shipping industry. ,0.306578947368,-3.77894736842,-6.87324561404,-3.07061403509,-1.67280701754
1028,2017-05-22 17:59:32,RSK Labs has received $3.5m in pre-Series A funding and opened up its production testnet to the public.,-4.07303923498,-4.76740169393,-5.81244343001,-5.08222598262,-1.04766527182
1029,2017-05-22 18:00:05,Toyota Research Institute (TRI) is going big with a bold blockchain strategy unveiled as part of its exhibit at Consensus 2017.,-0.723844947672,-2.40081318601,-1.4645553003,-0.0396564927251,3.10733690698
1030,2017-05-22 18:30:49,"A panel focused on bitcoin scaling drew crowds at Consensus 2017 today, though panelists painted a somewhat murky picture of potential paths forward.",-0.723844947672,-2.40081318601,-1.4645553003,-0.0396564927251,3.10733690698
1031,2017-05-22 19:00:08,"ShapeShift has unveiled a new product called 'Prism', one that brings a whole new style of investment to the cryptocurrency markets.",-1.68919539385,-8.03182794909,-0.865488806039,0.214420834175,3.02944039376
1032,2017-05-22 19:30:19,The Initiative For CryptoCurrencies & Contracts (IC3) has unveiled a new version of its Teechan off-chain transaction protocol.,-1.68919539385,-8.03182794909,-0.865488806039,0.214420834175,3.02944039376
1033,2017-05-22 19:45:54,Enterprise blockchain was on full display at Consensus 2017 in New York City today.,-1.68919539385,-8.03182794909,-0.865488806039,0.214420834175,3.02944039376
1034,2017-05-22 20:00:42,Blockchain startup Nuco has launched into beta with a partnership with TMX Group in Canada.,-6.45161290323,-0.83505746858,1.34599307855,1.78267022236,4.82072885385
1035,2017-05-22 20:15:33,BitPay is expanding its prepaid bitcoin card offerings to more than 100 new countries.,-6.45161290323,-0.83505746858,1.34599307855,1.78267022236,4.82072885385
1036,2017-05-22 20:32:30,Cross-border blockchain use was up for debate during today's Consensus 2017 panels. ,-6.45161290323,-0.83505746858,1.34599307855,1.78267022236,4.82072885385
1037,2017-05-22 21:45:14,"Deloitte has unveiled a new trade finance initiative, one that adds to its growing list of blockchain projects",6.00390408531,7.54007678367,9.3772934005,10.6613480577,12.9543741232
1038,2017-05-22 21:45:16,Deloitte has revealed that it's joining two blockchain consortium efforts: the Enterprise Ethereum Alliance and the Hyperledger project.,6.00390408531,7.54007678367,9.3772934005,10.6613480577,12.9543741232
1039,2017-05-22 22:50:18,"Privacy and confidentiality are big-ticket priorities for the Enterprise Ethereum Alliance, ethereum-focused consortium launched in February.",1.44916615253,1.80945607995,4.08328584414,4.80292376454,7.03907615069
