,date,title,1hr_change,2hr_change,6hr_change,12hr_change,24hr_change
2731,2017-11-15 20:45:30,A well-known electronic brokerage firm is issuing dire warnings against the CME Group's plan to launch a bitcoin futures contract next month.,-0.424073706746,-0.219560741719,-0.672635618087,1.914487589,7.97477445435
2732,2017-11-15 21:31:03,"A second class action lawsuit has been filed against the founders of blockchain startup Tezos, alleging violation of U.S. securities law. ",0.205383944333,-0.508857611914,-0.763698559565,2.96000164857,7.01025545916
2733,2017-11-16 03:30:53,The court asked India's central bank and several government agencies to respond to a petition that expressed concern about tax dodges and ransomware.,-0.0467919805744,0.773452057601,3.75235690376,3.37151448198,9.36587175675
2734,2017-11-16 05:10:55,"'Big four' consulting firm KPMG has announced it is joining the industry trade group, the Wall Street Blockchain Alliance.",1.38295694796,1.64342047963,1.93383182243,7.44367956941,8.03384377408
2735,2017-11-16 09:02:02,A new paper outlines an additional layer to the Lightning Network that would make payment channels even more scalable. ,-1.12255504363,-0.992860106932,-0.367068694284,3.93381288436,5.14363180515
2736,2017-11-16 10:00:27,Morgan Stanley Chairman and CEO James Gorman has added to recent criticism of bitcoin in new comments.,0.131167362537,0.0623449809591,3.84082867545,5.77770640642,5.71657593808
2737,2017-11-16 11:00:26,"Moldova is considering teaming with a U.N. blockchain identity project to help combat child trafficking in the country, according to a report.",-0.0687322273285,0.725866228218,5.40531798763,6.81823695098,4.51341626124
2738,2017-11-16 12:00:46,A high-profile ICO project is re-evaluating whether it will stick with the ethereum network or shift to a more scalable and lower-cost solution.,0.795144976399,0.606877950101,4.65246122724,6.35590020229,5.56992582603
2739,2017-11-16 12:35:26,"Bitcoin is showing no signs of stopping its recent upwards surge. As prices climb once again, are new highs on the horizon?",0.795144976399,0.606877950101,4.65246122724,6.35590020229,5.56992582603
2740,2017-11-16 13:00:03,"American Express just had its ""Charles Lindbergh moment,"" using Ripple's blockchain to connect Santander clients in Europe and the U.S. ",-0.186781839881,-0.0931233241816,3.90729947712,5.98130040835,5.82060915499
2741,2017-11-16 14:15:31,"Bitcoin cash has lost 20 percent in the last 24 hours, but looks to have found a new bottom around $1,000.",0.0938337801609,3.15013404826,5.80442359249,6.37332439678,6.72855227882
2742,2017-11-16 15:00:24,The CFO of mobile payments firm Square has explained why the company launched a bitcoin pilot scheme.,3.0534351145,4.74327038971,4.31672693183,5.7988482657,5.63814115441
2743,2017-11-16 16:00:10,The ad-blocking browser provides YouTubers with an alternative monetization strategy in a year of aggravation with the video site's ad-killing bots.,1.63976608187,0.844444444444,1.86523716699,2.92384665367,1.81364522417
2744,2017-11-16 17:05:13,"Bitcoin's astonishing price rally this year continues to attract skeptics, including the CIO of Japan Post Bank. ",-0.78249062162,-0.70564799685,1.34046269233,0.54927773047,0.3757744995
2745,2017-11-16 18:20:51,New survey data highlights the ideological – and economic – factors driving some investors to purchase bitcoin.,0.0774486532182,1.71430854203,1.6277103807,-2.88634764523,0.853094982204
2746,2017-11-16 18:40:19,"The price of bitcoin is spiking, climbing above $7,700 for first time since Nov. 8.",0.0774486532182,1.71430854203,1.6277103807,-2.88634764523,0.853094982204
2747,2017-11-16 20:45:08,"In a new patent application, Dell subsidiary VMWare outlines how it could integrate a blockchain into a proposed cloud-based data transfer service.",-1.31356732096,-0.690230976522,0.537690944266,-1.17889119613,-2.59723476849
2748,2017-11-16 21:40:29,Cryptocurrency wallet and exchange startup Coinbase is launching a new storage service aimed specifically at institutional investors.,0.631633272695,1.75483642367,1.42078972132,1.16402822836,-0.273579370755
2749,2017-11-17 01:35:27,An experimental blockchain boasting an innovative array of potential features is now entering a new phase of testing.,0.182426461305,-0.265118040651,-1.98522913774,-0.151622269915,-5.01817952279
2750,2017-11-17 04:00:47,EU Commission has released a report titled 'Blockchain in Education' that explains on potentials of the nascent technology in the education industry.,-0.705177658053,-4.84836470753,-1.08573369411,-1.07866297811,-2.33548274682
2751,2017-11-17 05:30:27,Swiss bank Vontobel and Leonteq Securities announced that they will start trading Switzerland’s first two mini futures to short bitcoin on Friday.,-4.17261137264,-1.27655407966,-1.38781862988,-0.172555422462,-2.73558202168
2752,2017-11-17 08:10:25,Stock exchange operator Nasdaq filed a patent outlining how to store asset ownership data on a blockchain. ,1.02615910851,0.436412494423,2.07680552208,-1.43526377058,-0.184872742937
2753,2017-11-17 09:00:30,Class-action litigators in the U.S. appear to be positioning for a potential pop in the hot initial coin offering market.,-0.583756345178,-1.58629441624,0.10152284264,-1.42106598985,-1.65647208122
2754,2017-11-17 10:20:06,A number of banks have joined the recently announced blockchain-based trade network pilot jointly set up by Hong Kong and Singapore.,-1.00842481491,-0.0764615777381,0.00714832780189,-1.52272147051,-0.519402604034
2755,2017-11-17 11:30:51,"Our duty to users doesn't end when they leave our site or app. Behaviors learned from us guide interactions with other services, writes Dan Elitzer.",0.941457124436,1.98568665377,1.23236621534,-1.67595099936,-0.479561573179
2756,2017-11-17 12:30:04,"Bitcoin has staged a remarkable ""V"" shaped recovery from the last week's lows near $5,500, and may be looking at new highs ahead.",1.0344902472,1.7110351162,-0.0233775889402,-3.5514773231,-2.13298143462
2757,2017-11-17 13:35:07,Credit card giant Visa has launched the trial phase of its business-to-business payments system built with blockchain startup Chain.,0.669617738801,-0.265394190662,-2.74194302939,-4.87394724232,-2.41497334046
2758,2017-11-17 14:30:16,"Positive news flow for Ripple seems to be boosting price, while the technical analysis also favors the bulls.",-0.928792569659,-1.59998492832,-3.44061442235,-3.92868581189,-3.4782936341
2759,2017-11-17 15:30:09,The European Central Bank's Ewald Nowotny has said that China's recent crackdown has brought new focus on cryptocurrency regulations.,-0.677484787018,-0.474518255578,-1.52104462475,-1.43230223124,-2.90365111562
2760,2017-11-17 16:45:54,"The Internet Archive, host of the Wayback Machine, has announced it now supports donations in bitcoin cash and zcash.",0.20435097823,-0.106961973614,-1.52976044602,-1.27052444553,-1.23682759466
2761,2017-11-17 17:45:12,"The Segwit2x bitcoin fork may have been formally called off, but as many as 150 nodes still running its code have stopped accepting transaction blocks",-0.310678078152,-2.01819740477,-2.87291241273,-2.5674568853,-1.13584109179
2762,2017-11-17 18:45:35,An experimental consensus algorithm that's long been proposed as a pillar of the ethereum protocol could soon see its first testing.,-1.71284074734,-1.76548456591,-3.52892471167,-0.997293698842,-0.971993999627
2763,2017-11-17 21:00:51,UBS chief investment officer Mark Haefele says the world's largest money manager will not include bitcoin investments.,-0.686275267056,-1.84075221228,0.090113053262,-0.238799591144,0.678165092263
2764,2017-11-17 22:10:22,"A Mt Gox initial coin offering (ICO)? It's not that much of a far-fetched idea, according to the defunct bitcoin exchange's controversial CEO.",-1.16245458352,-2.13501220396,0.263263298296,1.01883285308,0.807548177443
2765,2017-11-18 11:45:22,"Bitcoin cash's big ups and downs have had market impacts far and wide, while showcasing the nascent nature of the crypto sector as a whole.",-0.735571360269,0.00233226783245,0.56479752676,0.430044274218,0.130995709923
2766,2017-11-18 12:40:19,How to structure token sales that comply with securities laws open participation to a diverse range of purchasers and enhance value for all involved.,0.743371657112,0.312881801949,1.16263588233,2.0240071844,1.84113384084
2767,2017-11-18 21:59:30,"The first ever LedgerX long-term bitcoin futures option pegs the cryptocurrency price at $10,000 by next December.",-0.55864564553,-0.891224570691,-0.406613218766,-0.620021225721,2.65807408544
2768,2017-11-19 10:30:13,"The ICO neighborhood, so to speak, is cleaning up, though University of Dublin's Paul Ennis suggests this may not exactly be a future to fear.",-0.271906403286,0.685250593948,2.7474548296,3.64989501858,3.98800359789
2769,2017-11-19 11:40:19,Many agree that the now-commonplace ICO presale to public sale process is too compressed and goes against the funding method's original intent. ,0.959766664251,0.751560575161,3.36532986884,4.11611403845,5.37337343037
2770,2017-11-20 03:16:42,"Bitcoin's price rose above $8,100 for the first time on Sunday.",-0.0138352064873,0.0,0.275457714748,2.70472054753,-2.04449452263
2771,2017-11-20 06:00:35,The CME’s plan to offer bitcoin futures will benefit the futures trading and bitcoin communities alike – notwithstanding hand-wringing in both…,0.461058615503,0.18704026537,1.68199167353,2.33632107624,1.56573013616
2772,2017-11-20 07:00:20,A plurality of respondents to a new survey from brokerage firm Triad Securities said they believe bitcoin is in a bubble that's primed to crash.,-0.272760763135,-0.209625143109,2.48411996512,2.20776208415,1.71160789927
2773,2017-11-20 09:00:06,The hottest industry term in cryptocurrnecy is proving a doubled-edged sword for the entrepreneurs seeking to enter the market.,0.160470148948,1.21887705699,2.42258962276,2.93234026632,1.8520567152
2774,2017-11-20 10:00:05,The Smart Dubai Office won an award for its blockchain initiative at the Smart Cities Expo and World Congress last week.,1.05671120201,1.26544734314,2.60597516512,2.45705520711,1.85417757712
2775,2017-11-20 11:01:00,The Australian government has announced that it will provide over AU$8 million in grants for a blockchain-powered smart utilities project.,0.206553467507,1.46269818756,0.942016438316,1.43445365871,0.890685077187
2776,2017-11-20 12:15:22,"Bitcoin prices are at their highest ever, but there may be a chink in the cryptocurrency's armor – low volumes.",1.25355545779,0.77843232651,0.643505690571,1.28100647182,0.781250957415
2777,2017-11-20 13:00:05,"A former executive of the National Depository of Ukraine left because of politics, but found ""game-changing"" opportunities in blockchain.",-0.469240935916,-0.269538190427,-0.269659222394,-1.92247176324,0.94053941527
2778,2017-11-20 14:00:18,"With talk of a possible derivatives market on the way, the price of ether, ethereum's native token, looks to be on the rise.",0.200644250448,0.541131463329,0.612998585762,-3.69112459278,1.44390898777
2779,2017-11-20 15:18:03,"The price of bitcoin has hit yet another all-time high, passing above $8,200 for the first time.",0.339805412858,-0.244295820029,0.49769357076,-4.62414487361,0.509465401134
2780,2017-11-20 16:05:10,Financial firms including JPMorgan Chase and Goldman Sachs have carried out equity swaps over a DLT system.,-0.582123146924,-0.671382835773,-0.145137705445,-2.334419044,0.385703452221
2781,2017-11-20 17:00:58,"CME Group's planned bitcoin futures product could start trading on Dec. 11, according to the firm's website. ",-0.0897823325888,0.244772429768,0.487841671655,-1.87192513759,0.524460211098
2782,2017-11-20 18:05:01,"The domain name Ethereum.com is up for grabs, according to reports. The cost? Around $10 million.",0.334855403349,0.747884322679,0.633424657534,-0.75299847793,-0.949528158295
2783,2017-11-20 19:30:59,The State Bank of India is planning to beta launch smart contracts and blockchain-based know-your-customer processes.,0.411650485437,0.497815533981,-1.6572815534,-0.485436893204,-0.121966019417
2784,2017-11-20 21:10:04,Options exchange CBOE has released early specifications for its planned bitcoin futures product.,-0.302015935235,-0.254074981101,-5.09647362281,-1.04950839389,-3.38750540392
2785,2017-11-20 22:45:02,Prosecutors in the Russian state of Tatarstan have issued a warning to a local businessman about two bitcoin ATMs.,0.0480861820661,0.103076425537,-2.19246342967,-0.588419829918,-1.78064222306
2786,2017-11-21 04:15:59,The team behind the stable cryptocurrency Tether is claiming $30 million worth of its funds have been sent to an unauthorized address.,-0.11133126935,0.936965944272,1.64,2.78513931889,1.17696594427
2787,2017-11-21 07:00:22,Ethereum development startup ConsenSys is expanding to London.,0.243902439024,-0.0718292682927,1.70719512195,0.365243902439,0.987804878049
2788,2017-11-21 09:00:22,"Often trumpeted as the future of bitcoin, the success of the Lightning Network may come down to economic forces, say researchers.",0.162555787023,0.263481940076,1.07247766994,-2.36279473915,1.27969968673
2789,2017-11-21 10:00:15,"The European Parliament has released a research paper that touts blockchain in the prevention of odometer fraud or ""clocking.""",0.10076235801,0.198722377163,1.12666206108,-1.19927918971,0.876279176307
2790,2017-11-21 11:00:38,Distributed ledger startup R3 is moving to more deeply integrate its Corda platform with Microsoft's Azure cloud service.,0.0978614116874,1.51283518142,0.575605243619,-0.746740995898,0.308068697737
2791,2017-11-21 12:15:21,"Fears over a cryptocurrency hack revealed yesterday saw a brief crash in prices, but bitcoin soon bounced back.",1.4135904102,1.44107182377,-1.08490783999,-0.653595566008,-0.433987455829
2792,2017-11-21 13:00:32,Bitcoin infrastructure company Blockstream has expanded its partnership with IT firm Digital Garage to boost blockchain development in Japan.,0.027098353835,-0.69544447895,-1.31942604248,-1.84760413382,-1.2107928187
2793,2017-11-21 14:01:10,The Russian minister of communications and mass media said yesterday that the country will not consider the legalization of digital currencies.,-0.722347088615,-0.507656807216,-2.16440408763,-1.82528694297,-1.34544037879
2794,2017-11-21 15:15:39,The foreign exchange office of the Moroccan government has stated that the use of cryptocurrencies can lead to penalties under existing rules.,0.216252374127,-0.229413462223,-3.3988208148,-1.14936144574,-0.748491606486
2795,2017-11-21 16:50:15,European Central Bank president Mario Draghi reiterated his view that cryptocurrencies are too small to regulate on Monday.,-0.444704153062,-1.99255412716,-2.30002771118,-1.56459716382,-1.6998999988
2796,2017-11-21 17:40:30,"Making ICOs compliant while delivering on their disruptive promise may be a harder needle to thread than the SAFT plan anticipates, a new paper says.",-1.55476407451,-0.399855258206,-1.31477830664,-0.638509788829,-1.27108952086
2797,2017-11-21 20:00:39,The individual or group behind the alleged Tether attack may have been involved in a previous well-known hack in the bitcoin space. ,-1.97495861764,-0.645577080237,0.346619388877,1.26530167159,0.714312844521
2798,2017-11-21 21:30:00,"The Ethereum Foundation's lead developer for the Casper upgrade, Vlad Zamfir, uploaded the first version of the protocol's code to GitHub on Tuesday.",1.35616523967,1.9230048122,2.32860446222,3.73064183489,3.30679332542
2799,2017-11-21 22:30:17,"Ben Lawsky, the former New York Superintendent of Financial Services who spearheaded the BitLicense regulatory framework while in office, has joined…",0.5592551486,0.752127266001,0.752743864842,2.10075225059,1.73880873104
2800,2017-11-22 05:00:21,A hodgepodge of state laws intended to sanction blockchain technology could end up making nationwide solutions commercially impracticable.,0.548096703746,0.861973416092,0.374898145363,-0.636644771218,0.496697412862
2801,2017-11-22 07:00:06,"A group of CFOs polled by CNBC are split on whether bitcoin is a bubble, according to newly published results.",-0.193696413477,0.217002777442,-0.507064364207,-0.97935032001,-1.1678541239
2802,2017-11-22 08:00:35,One of Italy's largest banks is re-imagining what the $1.2 quadrillion derivatives market would look like on a public blockchain.,0.411496244386,0.174108525631,-0.422869560167,-0.544104266687,-1.06413098188
2803,2017-11-22 10:00:01,"Blockchain startup Nivaura will today initiate its first bond denominated in ether. And, notably, the issuance will be conducted on a blockchain.",-0.463079831146,-1.10274357287,-1.45591139401,-0.35449642786,-1.49407864144
2804,2017-11-22 11:00:19,"Philippine regulators are eyeing new rules for cryptocurrency exchanges and initial coin offerings (ICOs), according to officials.",-0.642639676447,-0.0242688699565,-1.00776482494,-0.060793519241,-0.794926835424
2805,2017-11-22 11:35:12,"Following a two-month period in the doldrums, the price of the privacy-focused cryptocurrency monero has climbed to a new all-time high of over $155.",-0.642639676447,-0.0242688699565,-1.00776482494,-0.060793519241,-0.794926835424
2806,2017-11-22 12:25:16,"Billionaire Mike Novogratz has restated his belief that bitcoin will end the year at $10,000, while ethereum could hit $500.",0.622370405652,0.512454125219,0.119808745672,0.207131124016,0.207253253217
2807,2017-11-22 13:10:12,"Bitcoin cash may be vying for the top spot in bitcoin software, but it's still working to correct fundamental usability problems.",-0.10923642525,-0.230731604889,-0.474692954615,-0.03641214175,-0.534166119473
2808,2017-11-22 14:00:06,The governor of Malaysia's central bank has provided more detail on upcoming regulations aimed to counter the illicit uses of cryptocurrencies.,-0.121628041764,-0.86512653083,-0.121749548299,-0.194531962902,-0.364398099152
2809,2017-11-22 15:45:30,The Reserve Bank of Zimbabwe (RBZ) has cast doubt on the legality of bitcoin in the country.,-0.744403892944,-0.754744525547,0.548175182482,0.023600973236,-0.510948905109
2810,2017-11-22 17:00:40,Standard Chartered and Axis Bank have announced a new cross-border payments platform built on top of technology developed by Ripple.,0.489092861451,0.514099113014,0.956611701945,1.1406037784,-0.0729349003918
2811,2017-11-22 18:05:06,A French asset manager has announced the launch of Europe's first mutual fund centered around bitcoin.,0.0248845430393,0.269948498755,0.0872178836916,-0.442554520326,-0.439138994811
2812,2017-11-22 19:05:21,Former Major League Baseball star Jose Canseco is apparently a big believer in blockchain and cryptocurrencies.,0.245002987841,0.79464383712,0.440371224039,-0.190368175222,-0.169514262369
2813,2017-11-22 20:55:26,A scammer successfully made more than $3 million after getting the private keys to bitcoin gold users' wallets during the fork's launch period.,0.548297504012,0.365085602294,-0.0728711348797,-0.522871682326,-0.547689230765
2814,2017-11-23 09:20:52,Nasdaq has entered into an agreement with South African central securities depository Strate to deliver a blockchain solution for e-voting.,0.270481272246,0.514529147431,0.54526565564,0.262612726144,0.754273911467
2815,2017-11-23 10:00:07,Raiffeisen Bank International (RBI) has become the first Austrian banking group to join the R3 distributed ledger consortium.,0.243389552028,0.605347213282,0.18833569366,-1.52642646509,1.27948109593
2816,2017-11-23 11:00:14,An obscure provision tucked into a U.S. defense spending bill could act as a springboard for blockchain adoption across government agencies.,0.361078833099,0.238517521864,-0.287321876338,-1.87401382178,0.4832731943
2817,2017-11-23 12:00:11,"Bitcoin is continuing its sideways journey today, with a pullback looking possible. However, the broader outlook still remains bullish.",-0.122120360462,-0.0609383036239,-0.526019436881,-2.48567340482,0.230956170734
2818,2017-11-23 12:40:55,"The governor of a South Korean financial regulator has said it has ""no plans"" to supervise cryptocurrency trading.",-0.122120360462,-0.0609383036239,-0.526019436881,-2.48567340482,0.230956170734
2819,2017-11-23 13:30:17,KyberNetwork is teaming up with a University of California blockchain group for research on ways to improve the decentralized exchange model.,0.0612568639414,-0.207443563148,-0.109823062843,-0.793166564979,-0.103355704698
2820,2017-11-23 14:25:19,"Amid high trading volumes in South Korea, bitcoin cash is flying high today and could gain more altitude in the near-term.",-0.2685359304,-0.353779624928,-0.305487059788,-1.03292430994,-0.129389928317
2821,2017-11-23 15:00:28,Air New Zealand is partnering with decentralized travel platform Winding Tree to explore blockchain tech for ticket booking and baggage tracking.,-0.0854732208364,-0.317803864025,-0.281120078259,-1.07593543654,0.269014428956
2822,2017-11-23 15:32:21,"The price of ether, ethereum's native token, has brushed all-time highs above $400 – falling just a dollar short of June's record.",-0.0854732208364,-0.317803864025,-0.281120078259,-1.07593543654,0.269014428956
2823,2017-11-24 09:10:37,The chairman of Swiss National Bank said yesterday that he sees bitcoin more as an investment than a currency.,0.793166564979,0.244173276388,0.0610128126907,0.976205003051,3.11177547285
2824,2017-11-24 10:00:06,"Bermuda has launched a new working group aimed to advance the regulatory and commercial environment for token sales, cryptocurrencies and more.",-0.544673123487,-0.436198547216,-0.276150121065,-0.544673123487,2.60290556901
2825,2017-11-24 11:15:55,"Air services provider Dnata, IBM and others have completed of a proof-of-concept examining blockchain's potential in the air cargo industry.",0.10906864386,-0.346682475128,0.548142972437,0.0289713585254,5.14424206422
2826,2017-11-24 12:15:21,"Despite a dip to below $8,000 overnight, bitcoin once again approached record highs today and is holding at over $8,200.",-0.455254578993,-0.420234995993,0.199781857181,-0.109193005325,5.08318974899
2827,2017-11-24 13:00:32,"Overstock subsidiary tZERO is adding features to its upcoming security token, allowing investors to use the coin to purchase a handful of services. ",0.0351797403784,0.164538577395,0.775175807088,0.550782810299,5.05061362995
2828,2017-11-24 14:05:51,"Having hit a fresh all-time high of over $440 today, could high trading volumes push ether to new records over the weekend?",0.129313344917,0.583436413612,1.0329193434,0.483429209186,5.81958895696
2829,2017-11-24 15:00:11,Online banking service Swissquote has launched a bitcoin exchange-traded certificate that it claims will curb the cryptocurrency's volatility.,0.453536585366,0.732195121951,0.914634146341,0.75987804878,6.62195121951
2830,2017-11-24 16:00:02,"With $160 million in funds frozen on the ethereum blockchain, a search for solutions is ongoing – if not altogether promising so far.",0.277400424174,0.0389696000699,-0.269266582415,0.198611419671,6.16484505031
2831,2017-11-25 10:30:47,"The top two cryptocurrencies by market capitalization have continued their respective rallies, setting fresh record highs today.",1.9187020649,1.97061946903,3.18584070796,3.78171091445,6.9608259587
2832,2017-11-25 11:00:11,"The challenges of digital identity, AML/KYC and common technical standards must be overcome to deliver on the promise of blockchain technology.",0.0509400169723,-0.435421372347,0.552236093086,3.07249343279,4.79808650773
2833,2017-11-25 12:00:24,The SEC and the CFTC? A panel of top ICO lawyers discussed pressing legal challenges in the sector on Tuesday.,-0.486113762886,0.277597457073,0.671024449173,2.92732824887,4.95255154761
2834,2017-11-26 12:22:52,"The price of a bitcoin has continued to rise overnight, passing $9,000 for the first time this morning.",-0.330870638511,1.36703267141,2.99404300547,6.80241807892,6.86868040939
2835,2017-11-26 12:45:16,The identity or character of a creator has little bearing on the value of the creation – that's why the obsession with unmasking Satoshi was so…,-0.330870638511,1.36703267141,2.99404300547,6.80241807892,6.86868040939
2836,2017-11-26 14:00:36,"A former lawyer for the SEC discusses the way forward for ICO regulation, warning that an ""assembly line"" of actions could be on the way.",2.0556884925,2.18131390037,2.62116597781,5.23167283011,5.2807265608
2837,2017-11-27 02:46:01,The total market capitalization for the cryptocurrency market has exceeded $300 billion for the first time.,0.66149870801,0.361757105943,0.289302325581,0.0466149870801,0.774160206718
2838,2017-11-27 05:00:17,"Blockchain startup Libra has raised $7.8 million in a new Series A funding round, the company announced today.",0.456978583315,0.703139087382,0.063987305578,-1.19576921294,2.05923720125
2839,2017-11-27 09:00:35,Samsung SDS announced yesterday that it has signed an agreement with the Seoul Metropolitan Government to build out blockchain services.,0.112716466851,-0.489189466134,-1.59698739625,-0.684906240393,1.68859514294
2840,2017-11-27 10:10:12,"The secretary of Iran's High Council of Cyberspace has said the agency ""welcomes"" bitcoin, with the caveat that there must be regulation.",-0.601228249744,-0.78812691914,-1.74002047083,-0.0132036847492,1.83213920164
2841,2017-11-27 11:00:26,"Prices increases in ethereum, monero and other cryptocurrencies could spark a sales boost for makers of graphics cards (GPUs).",-0.188029153786,-0.237353340349,-1.25895094972,0.388518070776,2.63343788551
2842,2017-11-27 12:07:19,"With sentiment more bullish than ever, bitcoin prices look likely to test $10,000 levels – and perhaps beyond.",-0.0494171051274,-0.139172598783,-1.42267615805,0.670587021562,1.99896832766
2843,2017-11-27 14:00:27,Researchers are trying to improve prediction markets as potentially valuable tools for measuring community support or opposition to protocol changes.,-0.788882908329,-0.821425877963,-0.0465932676344,0.727206232547,2.63949311484
